id|name|main_attribute|subtitle|lore|lore_extended|attack_type|complexity|lore_extended|attack_type|complexity|asset_portrait_url|base_health|health_regeneration|base_mana|mana_regeneration|base_strength|strength_gain|base_agility|agility_gain|base_intelligence|intelligence_gain|role_carry|role_support|role_nuker|role_disabler|role_jungler|role_durable|role_escape|role_pusher|role_initiator|base_attack_damage_min|base_attack_damage_max|base_attack_time|base_attack_range|base_attack_projectile_speed|base_defense_armor|base_defense_magic_resist_perc|base_mobility_movement_speed|base_mobility_turn_rate|base_mobility_vision_day|base_mobility_vision_night
rubick|Rubick|Intelligence|Steals the spells of his enemies to use against them|Always seeking a new spell to steal, Rubick is ever eager to turn an enemy's most unique advantage against them. Snatching his enemies into the air to fling them where he will, he has no trouble sowing chaos among careless foes.|Any mage can cast a spell or two, and a few may even study long enough to become a wizard, but only the most talented are allowed to be recognized as a Magus. Yet as with any sorcerer's circle, a sense of community has never guaranteed competitive courtesy.<br>Already a renowned duelist and scholar of the grander world of sorcery, it had never occurred to Rubick that he might perhaps be Magus material until he was in the midst of his seventh assassination attempt. As he casually tossed the twelfth of a string of would-be killers from a high balcony, it dawned on him how utterly unimaginative the attempts on his life had become. Where once the interruption of a fingersnap or firehand might have put a cheerful spring in his step, it had all become so very predictable. He craved greater competition. Therefore, donning his combat mask, he did what any wizard seeking to ascend the ranks would do: he announced his intention to kill a Magus.<br>Rubick quickly discovered that to threaten one Magus is to threaten them all, and they fell upon him in force. Each antagonist's spell was an unstoppable torrent of energy, and every attack a calculated killing blow. But very soon something occurred that Rubick's foes found unexpected: their arts appeared to turn against them. Inside the magic maelstrom, Rubick chuckled, subtly reading and replicating the powers of one in order to cast it against another, sowing chaos among those who had allied against him. Accusations of betrayal began to fly, and soon the sorcerers turned one upon another without suspecting who was behind their undoing.<br>When the battle finally drew to a close, all were singed and frozen, soaked and cut and pierced. More than one lay dead by an ally's craft. Rubick stood apart, sore but delighted in the week's festivities. None had the strength to argue when he presented his petition of assumption to the Hidden Council, and the Insubstantial Eleven agreed as one to grant him the title of Grand Magus.|Ranged|3|Any mage can cast a spell or two, and a few may even study long enough to become a wizard, but only the most talented are allowed to be recognized as a Magus. Yet as with any sorcerer's circle, a sense of community has never guaranteed competitive courtesy.<br>Already a renowned duelist and scholar of the grander world of sorcery, it had never occurred to Rubick that he might perhaps be Magus material until he was in the midst of his seventh assassination attempt. As he casually tossed the twelfth of a string of would-be killers from a high balcony, it dawned on him how utterly unimaginative the attempts on his life had become. Where once the interruption of a fingersnap or firehand might have put a cheerful spring in his step, it had all become so very predictable. He craved greater competition. Therefore, donning his combat mask, he did what any wizard seeking to ascend the ranks would do: he announced his intention to kill a Magus.<br>Rubick quickly discovered that to threaten one Magus is to threaten them all, and they fell upon him in force. Each antagonist's spell was an unstoppable torrent of energy, and every attack a calculated killing blow. But very soon something occurred that Rubick's foes found unexpected: their arts appeared to turn against them. Inside the magic maelstrom, Rubick chuckled, subtly reading and replicating the powers of one in order to cast it against another, sowing chaos among those who had allied against him. Accusations of betrayal began to fly, and soon the sorcerers turned one upon another without suspecting who was behind their undoing.<br>When the battle finally drew to a close, all were singed and frozen, soaked and cut and pierced. More than one lay dead by an ally's craft. Rubick stood apart, sore but delighted in the week's festivities. None had the strength to argue when he presented his petition of assumption to the Hidden Council, and the Insubstantial Eleven agreed as one to grant him the title of Grand Magus.|Ranged|3|https://cdn.akamai.steamstatic.com/apps/dota2/images/dota_react/heroes/rubick.png|582|2.4|363|1.7|21|2.0|23|2.5|24|3.7|0|2|1|1|0|0|0|0|0|49|55|1.7|550|1125|4.8|25|290|0.7|1800|800
sandking|Sand King|Universal|Burrows to stun and slow enemies|Not many can survive an ambush from Sand King. Demolishing everything around him with waves of deadly vibration from his ultimate, he evades counterattacks by hiding himself in a scouring gust of sand, and stuns foes by striking them from beneath.|The sands of the Scintillant Waste are alive and sentient--the whole vast desert speaks to itself, thinking thoughts only such a vastness can conceive. But when it needs must find a form to communicate with those of more limited scope, it frees a fragment of itself, and fills a carapace of magic armor formed by the cunning Djinn of Qaldin. This essential identity calls itself Crixalis, meaning 'Soul of the Sand,' but others know it as Sand King. Sand King takes the form of a huge arachnid, inspired by the Scintillant Waste's small but ubiquitous denizens; and this is a true outward expression of his ferocious nature. Guardian, warrior, ambassador--Sand King is all of these things, inseparable from the endless desert that gave him life.|Melee|2|The sands of the Scintillant Waste are alive and sentient--the whole vast desert speaks to itself, thinking thoughts only such a vastness can conceive. But when it needs must find a form to communicate with those of more limited scope, it frees a fragment of itself, and fills a carapace of magic armor formed by the cunning Djinn of Qaldin. This essential identity calls itself Crixalis, meaning 'Soul of the Sand,' but others know it as Sand King. Sand King takes the form of a huge arachnid, inspired by the Scintillant Waste's small but ubiquitous denizens; and this is a true outward expression of his ferocious nature. Guardian, warrior, ambassador--Sand King is all of these things, inseparable from the endless desert that gave him life.|Melee|2|https://cdn.akamai.steamstatic.com/apps/dota2/images/dota_react/heroes/sand_king.png|604|2.5|279|0.8|22|2.3|19|2.0|17|2.0|0|1|2|2|0|0|2|0|3|45|55|1.7|150|900|4.2|25|290|0.6|1800|800
shadowdemon|Shadow Demon|Intelligence|Stacks exponential poison damage against his foes|Spewing clouds of demonic poison to damage enemies or scout the battlefield, few dare to approach Shadow Demon. Banishing an enemy as his allies gather for the kill, he can inflict demonic curses as he summons traitorous illusions to turn enemy strength against itself.|Among the sovereign Demons with explicit access to this world, Doom scarcely bothers with the affairs of Noninfernals and Lesser Spectral Consorts, while Shadow Fiend passes through almost exclusively on collecting expeditions. The Shadow Demon, however, has always taken a deep and abiding interest in the material plane, as if sensing that mastery of this gritty dimensional nexus might be the key to total domination of all realities.<br>Summoned first by minor wizards, the Shadow Demon granted every wish and put on increasingly impressive displays of power until he had the full attention of the greatest demonologists, and through them the various lords, tyrants, autarchs and heirophants who depended on sorcery to buttress their mundane power. So great was his deception that all his summoners considered themselves the master and Shadow Demon the servant; meanwhile, he eroded their identities and made their minds his own. In the end, most members of the cult were hollow puppets, extensions of his evil will.<br>What Shadow Demon's next step would have been remains open to speculation, for around this time, Nevermore the Shadow Fiend bit into a particularly nasty-tasting soul and discovered that it held nothing but a foul nougat of Shadow Demon's essence. Alerted that a coup was underway, and that the ancient equilibrium of the Umbral Pact was about to be destabilized, Doom and Shadow Fiend briefly joined forces to destroy the burgeoning cult. Combining spells of incredible force, they undid Shadow Demon's centuries of patient work, reducing his cult to smithereens--and all its members to a bloody splatter. Nothing remained except a tiny speck of demon shadow. Immortal and irreducible, this mote of evil was enough to seed the Shadow Demon's next scheme, and in fits and starts, over further centuries, he began to regroup.<br>Whatever that speck of shadow touched, it tainted, and its influence gradually grew. A chaos of damaged parts pulled together, reknit, and combined to give Shadow Demon a form even stronger than his former. He is all but complete now, and his plan for infinite dominion lacks all of its former weaknesses. It would seem that such a being of pure malice and malevolence, a threat to all creation, would be forever out of place in our world...yet Shadow Demon does not lack for followers.|Ranged|2|Among the sovereign Demons with explicit access to this world, Doom scarcely bothers with the affairs of Noninfernals and Lesser Spectral Consorts, while Shadow Fiend passes through almost exclusively on collecting expeditions. The Shadow Demon, however, has always taken a deep and abiding interest in the material plane, as if sensing that mastery of this gritty dimensional nexus might be the key to total domination of all realities.<br>Summoned first by minor wizards, the Shadow Demon granted every wish and put on increasingly impressive displays of power until he had the full attention of the greatest demonologists, and through them the various lords, tyrants, autarchs and heirophants who depended on sorcery to buttress their mundane power. So great was his deception that all his summoners considered themselves the master and Shadow Demon the servant; meanwhile, he eroded their identities and made their minds his own. In the end, most members of the cult were hollow puppets, extensions of his evil will.<br>What Shadow Demon's next step would have been remains open to speculation, for around this time, Nevermore the Shadow Fiend bit into a particularly nasty-tasting soul and discovered that it held nothing but a foul nougat of Shadow Demon's essence. Alerted that a coup was underway, and that the ancient equilibrium of the Umbral Pact was about to be destabilized, Doom and Shadow Fiend briefly joined forces to destroy the burgeoning cult. Combining spells of incredible force, they undid Shadow Demon's centuries of patient work, reducing his cult to smithereens--and all its members to a bloody splatter. Nothing remained except a tiny speck of demon shadow. Immortal and irreducible, this mote of evil was enough to seed the Shadow Demon's next scheme, and in fits and starts, over further centuries, he began to regroup.<br>Whatever that speck of shadow touched, it tainted, and its influence gradually grew. A chaos of damaged parts pulled together, reknit, and combined to give Shadow Demon a form even stronger than his former. He is all but complete now, and his plan for infinite dominion lacks all of its former weaknesses. It would seem that such a being of pure malice and malevolence, a threat to all creation, would be forever out of place in our world...yet Shadow Demon does not lack for followers.|Ranged|2|https://cdn.akamai.steamstatic.com/apps/dota2/images/dota_react/heroes/shadow_demon.png|626|2.5|339|1.1|23|2.6|18|2.2|22|3.6|0|2|1|2|0|0|0|0|1|51|55|1.7|500|900|3.0|25|290|0.6|1800|800
shadowfiend|Shadow Fiend|Agility|Unleashes the souls of fallen enemies for damage|Capturing souls from every kill he makes, Shadow Fiend is always gathering his power. Every assault, each carefully aimed raze that kills an enemy, brings him closer to unleashing his gathered souls in a deadly blast of scouring energy.|It is said that Nevermore the Shadow Fiend has the soul of a poet, and in fact he has thousands of them. Over the ages he has claimed the souls of poets, priests, emperors, beggars, slaves, philosophers, criminals and (naturally) heroes; no sort of soul escapes him. What he does with them is unknown. No one has ever peered into the Abysm whence Nevermore reaches out like an eel from among astral rocks. Does he devour them one after another? Does he mount them along the halls of an eldritch temple, or pickle the souls in necromantic brine? Is he merely a puppet, pushed through the dimensional rift by a demonic puppeteer? Such is his evil, so intense his aura of darkness, that no rational mind may penetrate it. Of course, if you really want to know where the stolen souls go, there's one sure way to find out: Add your soul to his collection. Or just wait for Nevermore.|Ranged|2|It is said that Nevermore the Shadow Fiend has the soul of a poet, and in fact he has thousands of them. Over the ages he has claimed the souls of poets, priests, emperors, beggars, slaves, philosophers, criminals and (naturally) heroes; no sort of soul escapes him. What he does with them is unknown. No one has ever peered into the Abysm whence Nevermore reaches out like an eel from among astral rocks. Does he devour them one after another? Does he mount them along the halls of an eldritch temple, or pickle the souls in necromantic brine? Is he merely a puppet, pushed through the dimensional rift by a demonic puppeteer? Such is his evil, so intense his aura of darkness, that no rational mind may penetrate it. Of course, if you really want to know where the stolen souls go, there's one sure way to find out: Add your soul to his collection. Or just wait for Nevermore.|Ranged|2|https://cdn.akamai.steamstatic.com/apps/dota2/images/dota_react/heroes/nevermore.png|538|2.1|291|1.2|19|2.7|25|3.5|18|2.2|2|0|3|0|0|0|0|0|0|41|47|1.6|525|1200|5.2|25|305|0.9|1800|800
shadowshaman|Shadow Shaman|Intelligence|Summons powerful serpent wards to deal damage|Shadow Shaman quickly clears the way for his team's forces to march on the enemy base. Blasting enemies with shocking spells and interrupting attackers with hexes, his powerful serpent wards destroy enemy defenses with ease.|Born in the Bleeding Hills, Rhasta was just a starving youngling when picked up by a travelling con-man. For two pins of copper, the old con-man would tell your fortune. For three, he'd castrate your pig, for five, he'd circumcise your sons. For a good meal, he'd don his shaman garb, read from his ancient books, and lay a curse upon your enemies. His strange new youngling, part hill troll, part...something else, worked as assistant and lent an air of the exotic to the con-man's trade. <br>Always one step ahead of cheated customers, one town ahead of a pursuing patronage, the two trekked across the blighted lands until one day the con-man realized that the little youngling could actually do what he only pretended at. His ward had a gift--a gift that customers valued. And so the youngling Rhasta was thrust before the crowds, and the trade-name Shadow Shaman was born. The two continued from town to town, conjuring for money as Shadow Shaman's reputation grew. Eventually, the pair's duplicitous past caught up with them, and they were ambushed by a mob of swindled ex-clients. The con-man was slain, and for the first time, Rhasta used his powers for darkness, massacring the attackers. He buried his beloved master, and now uses his powers to destroy any who would seek to do him harm.|Ranged|1|Born in the Bleeding Hills, Rhasta was just a starving youngling when picked up by a travelling con-man. For two pins of copper, the old con-man would tell your fortune. For three, he'd castrate your pig, for five, he'd circumcise your sons. For a good meal, he'd don his shaman garb, read from his ancient books, and lay a curse upon your enemies. His strange new youngling, part hill troll, part...something else, worked as assistant and lent an air of the exotic to the con-man's trade. <br>Always one step ahead of cheated customers, one town ahead of a pursuing patronage, the two trekked across the blighted lands until one day the con-man realized that the little youngling could actually do what he only pretended at. His ward had a gift--a gift that customers valued. And so the youngling Rhasta was thrust before the crowds, and the trade-name Shadow Shaman was born. The two continued from town to town, conjuring for money as Shadow Shaman's reputation grew. Eventually, the pair's duplicitous past caught up with them, and they were ambushed by a mob of swindled ex-clients. The con-man was slain, and for the first time, Rhasta used his powers for darkness, massacring the attackers. He buried his beloved master, and now uses his powers to destroy any who would seek to do him harm.|Ranged|1|https://cdn.akamai.steamstatic.com/apps/dota2/images/dota_react/heroes/shadow_shaman.png|560|3.0|375|1.3|20|2.3|16|1.6|25|3.5|0|2|2|3|0|0|0|3|1|65|72|1.7|400|900|5.7|25|285|0.6|1800|800
silencer|Silencer|Intelligence|Can silence all enemies on the map|Silencer changes the dynamic of every battle when he shuts down the enemy's ability to cast their spells. As he cuts his foes to ribbons with his glaive, he steals their intelligence to add to his own, ensuring his foes are always at a disadvantage.|"Part of the seventh and final generation of a carefully designed pedigree, Nortrom was bred by the ancient order of the Aeol Drias to be the greatest magic user the world had ever seen. He was the prophesied one, the culmination of two-hundred years of careful pairings, a war-mage who would bring glory to the order, and destruction to their sworn enemies, The Knights of the Fold. <br>Raised with other young mages in a hidden cantonment among the hills of the Hazhadal barrens, the order's preceptors waited for Nortrom's abilities to manifest. While the other students honed their talents with fire, or ice, or incantatory spells, Nortrom sat silent and talentless, unable to cast so much as a hex. As the day of final testing approached, he still hadn't found his magic. In disgust, the preceptors berated him, while the children laughed. ""You are no mage,"" the head of the order declared. Still, Nortrom did not slink away. He entered the day of testing and faced down the young mages who had mocked him. And then his preceptors learned a valuable lesson: a lack of magic can be the greatest magic of all. Nortrom silenced the young mages one by one and defeated them in single combat, until he alone stood as champion of the Aeol Drias, in fulfillment of the prophecy."|Ranged|2|"Part of the seventh and final generation of a carefully designed pedigree, Nortrom was bred by the ancient order of the Aeol Drias to be the greatest magic user the world had ever seen. He was the prophesied one, the culmination of two-hundred years of careful pairings, a war-mage who would bring glory to the order, and destruction to their sworn enemies, The Knights of the Fold. <br>Raised with other young mages in a hidden cantonment among the hills of the Hazhadal barrens, the order's preceptors waited for Nortrom's abilities to manifest. While the other students honed their talents with fire, or ice, or incantatory spells, Nortrom sat silent and talentless, unable to cast so much as a hex. As the day of final testing approached, he still hadn't found his magic. In disgust, the preceptors berated him, while the children laughed. ""You are no mage,"" the head of the order declared. Still, Nortrom did not slink away. He entered the day of testing and faced down the young mages who had mocked him. And then his preceptors learned a valuable lesson: a lack of magic can be the greatest magic of all. Nortrom silenced the young mages one by one and defeated them in single combat, until he alone stood as champion of the Aeol Drias, in fulfillment of the prophecy."|Ranged|2|https://cdn.akamai.steamstatic.com/apps/dota2/images/dota_react/heroes/silencer.png|538|2.1|375|1.3|19|2.2|22|2.2|25|2.9|1|1|1|2|0|0|0|0|2|43|57|1.6|600|900|3.7|25|290|0.6|1800|800
skywrathmage|Skywrath Mage|Intelligence|Casts high damage magical spells on a single target|Deadly and fragile in equal measure, Skywrath Mage quickly destroys his enemies with a barrage of powerful magic. He silences foes while increasing their vulnerability to spells, meaning he has no trouble vaporizing any who stand against him.|A highly placed mage in the court of the Ghastly Eyrie, Dragonus lives a troubled existence. Sworn by birth to protect whoever sits within the Nest of Thorns, he hates the current Skywrath queen with all his soul. As a youth, high-born, he was a friend and companion to the eldest Skywrath princess, Shendelzare, first in line for the Nest. He had loved her warmly and unshakably, but as his studies took hold, his mind turned to arcane learning and the mastery of Skywrath sorcery.<br>Obsessed with matters aetherial, he missed the mundane signs of courtly treachery that hinted at a plot against Shendelzare, and lost his chance to foil it. When the court was shaken by a swift and violent coup, he emerged from his studies to discover his oldest and dearest friend had been lost to him. The Nest of Thorns now belonged to Shendelzare's ruthless younger sister, and Dragonus could do nothing. The magic of the Skywrath Mage serves only the sworn protector of the Skywrath scion, so to act against the Nest would render him helpless. He clings to his post, believing it to be the best hope of one day restoring his true love to her rightful place. Meanwhile, his secret is known only to the goddess Scree'Auk, whose magic it was transformed Shendelzare from a crippled physical creature into an embodiment of pure vengeful energy.<br>While he dreams of restoring his beloved queen to the Ghastly Eyrie, he dreams even more desperately of restoring Shendelzare herself to a fully healed physical form. The duplicity of his role at court tortures him, for he is a noble and good-hearted creature; but the worst torture of all is imagining the hatred that Vengeful Spirit must hold in her heart for him.|Ranged|1|A highly placed mage in the court of the Ghastly Eyrie, Dragonus lives a troubled existence. Sworn by birth to protect whoever sits within the Nest of Thorns, he hates the current Skywrath queen with all his soul. As a youth, high-born, he was a friend and companion to the eldest Skywrath princess, Shendelzare, first in line for the Nest. He had loved her warmly and unshakably, but as his studies took hold, his mind turned to arcane learning and the mastery of Skywrath sorcery.<br>Obsessed with matters aetherial, he missed the mundane signs of courtly treachery that hinted at a plot against Shendelzare, and lost his chance to foil it. When the court was shaken by a swift and violent coup, he emerged from his studies to discover his oldest and dearest friend had been lost to him. The Nest of Thorns now belonged to Shendelzare's ruthless younger sister, and Dragonus could do nothing. The magic of the Skywrath Mage serves only the sworn protector of the Skywrath scion, so to act against the Nest would render him helpless. He clings to his post, believing it to be the best hope of one day restoring his true love to her rightful place. Meanwhile, his secret is known only to the goddess Scree'Auk, whose magic it was transformed Shendelzare from a crippled physical creature into an embodiment of pure vengeful energy.<br>While he dreams of restoring his beloved queen to the Ghastly Eyrie, he dreams even more desperately of restoring Shendelzare herself to a fully healed physical form. The duplicity of his role at court tortures him, for he is a noble and good-hearted creature; but the worst torture of all is imagining the hatred that Vengeful Spirit must hold in her heart for him.|Ranged|1|https://cdn.akamai.steamstatic.com/apps/dota2/images/dota_react/heroes/skywrath_mage.png|582|2.4|351|1.4|21|2.0|13|0.8|23|4.1|0|2|3|1|0|0|0|0|0|39|49|1.7|625|1000|0.2|25|325|0.6|1800|800
