id|name|main_attribute|subtitle|lore|lore_extended|attack_type|complexity|lore_extended|attack_type|complexity|asset_portrait_url|base_health|health_regeneration|base_mana|mana_regeneration|base_strength|strength_gain|base_agility|agility_gain|base_intelligence|intelligence_gain|role_carry|role_support|role_nuker|role_disabler|role_jungler|role_durable|role_escape|role_pusher|role_initiator|base_attack_damage_min|base_attack_damage_max|base_attack_time|base_attack_range|base_attack_projectile_speed|base_defense_armor|base_defense_magic_resist_perc|base_mobility_movement_speed|base_mobility_turn_rate|base_mobility_vision_day|base_mobility_vision_night
emberspirit|Ember Spirit|Agility|Rapidly strikes and chains his foes|Swift and elusive, Ember Spirit strikes all nearby enemies in rapid succession, and ties them up with burning chains. Quickly rushing across the battlefield to arrive at one of his exploding remnants, few can avoid, or capture, his flame.|Lost within the Wailing Mountains, the Fortress of Flares lay abandoned, its training halls empty, its courtyard covered in leaves and dust. Upon a dais in its sealed temple rests a topaz cauldron filled with ancient ash, remnants of a pyre for the warrior-poet Xin. For three generations, Xin taught his acolytes the Bonds of the Guardian Flame, a series of mantras to train the mind and body for the harsh realities beyond the fortress walls.<br>However, in teaching a warrior's way he earned a warrior's rivals, and in his autumn Xin was bested and slain. His followers spread to the wind. Yet as years turned to centuries and followers to descendants, his teachings endured by subtle whisper and deed. Touched by the teacher's lasting legacy, the Burning Celestial, inquisitive aspect of fire, cast himself to the Fortress of Flares and reignited the pyre ash. From these glowing embers emerged an image of Xin, wreathed in flame, his thoughtful countenance prepared to train and to teach, and to spread the fires of knowledge to all who seek guidance.|Melee|2|Lost within the Wailing Mountains, the Fortress of Flares lay abandoned, its training halls empty, its courtyard covered in leaves and dust. Upon a dais in its sealed temple rests a topaz cauldron filled with ancient ash, remnants of a pyre for the warrior-poet Xin. For three generations, Xin taught his acolytes the Bonds of the Guardian Flame, a series of mantras to train the mind and body for the harsh realities beyond the fortress walls.<br>However, in teaching a warrior's way he earned a warrior's rivals, and in his autumn Xin was bested and slain. His followers spread to the wind. Yet as years turned to centuries and followers to descendants, his teachings endured by subtle whisper and deed. Touched by the teacher's lasting legacy, the Burning Celestial, inquisitive aspect of fire, cast himself to the Fortress of Flares and reignited the pyre ash. From these glowing embers emerged an image of Xin, wreathed in flame, his thoughtful countenance prepared to train and to teach, and to spread the fires of knowledge to all who seek guidance.|Melee|2|https://cdn.akamai.steamstatic.com/apps/dota2/images/dota_react/heroes/ember_spirit.png|604|2.7|315|1.0|22|2.3|22|3.2|20|2.2|2|0|1|1|0|0|3|0|1|55|59|1.7|150|900|3.7|25|300|0.8|1800|800
enchantress|Enchantress|Intelligence|Enchants neutral creeps to do her bidding|Harmful up close and lethal at a distance, Enchantress skewers foes with attacks imbued to become more damaging the further they fly. Whether inflicting powerful slows on her enemies or charming forest creatures to fight her battles, she is never short of tools to win a fight.|Aiushtha appears to be an innocent, carefree creature of the woods, and while this is certainly true, it is hardly the sum of her story. She well understands the suffering of the natural world. She has wandered far, and fared through forests bright and drear, in every clime and every season, gathering friends, sharing news, bringing laughter and healing wherever she goes. For in worlds wracked by war, forests are leveled for the building of ships and siege engines; and even in places of peace, the woods are stripped for the building of homes, and as fuel for countless hearths.<br>Aiushtha hears the pleas of the small creatures, the furtive folk who need green shade and a leafy canopy to thrive. She lends her ears to those who have no other listeners. She carries their stories from the wood to the world, believing that her own good cheer is a kind of Enchantment, that can itself fulfill the promise of a verdant future.|Ranged|2|Aiushtha appears to be an innocent, carefree creature of the woods, and while this is certainly true, it is hardly the sum of her story. She well understands the suffering of the natural world. She has wandered far, and fared through forests bright and drear, in every clime and every season, gathering friends, sharing news, bringing laughter and healing wherever she goes. For in worlds wracked by war, forests are leveled for the building of ships and siege engines; and even in places of peace, the woods are stripped for the building of homes, and as fuel for countless hearths.<br>Aiushtha hears the pleas of the small creatures, the furtive folk who need green shade and a leafy canopy to thrive. She lends her ears to those who have no other listeners. She carries their stories from the wood to the world, believing that her own good cheer is a kind of Enchantment, that can itself fulfill the promise of a verdant future.|Ranged|2|https://cdn.akamai.steamstatic.com/apps/dota2/images/dota_react/heroes/enchantress.png|494|1.9|339|1.6|17|2.0|19|2.1|22|4.0|0|2|0|1|0|1|0|2|0|43|53|1.7|575|900|4.2|25|320|0.6|1800|800
enigma|Enigma|Universal|Traps and damages enemies in a black hole|Widely feared for his ultimate ability, Enigma can summon a black hole capable of entrapping enemy forces, so that allies can then destroy them. An ever-present contingent of eidolons at his side, he pummels foes with ranged attacks.|Nothing is known of Enigma's background. There are only stories and legends, most of them apocryphal, passed down through the ages. In truth, Enigma is a mystery for whom the only true biography is description: he is a universal force, a consumer of worlds. He is a being of the void, at times corporeal, other times ethereal. A beast between the planes. <br>There are stories that say he was once a great alchemist who tried to unlock the secrets of the universe and was cursed for his arrogance. Other legends tell that he is an ancient being of strange gravity, the abyss personified--a twisted voice from out the original darkness, before the first light in the universe. And there are older legends that say he is the first collapsed star, a black hole grown complicated and sentient--his motivations unknowable, his power inexorable, a force of destruction unleashed upon existence itself.|Ranged|2|Nothing is known of Enigma's background. There are only stories and legends, most of them apocryphal, passed down through the ages. In truth, Enigma is a mystery for whom the only true biography is description: he is a universal force, a consumer of worlds. He is a being of the void, at times corporeal, other times ethereal. A beast between the planes. <br>There are stories that say he was once a great alchemist who tried to unlock the secrets of the universe and was cursed for his arrogance. Other legends tell that he is an ancient being of strange gravity, the abyss personified--a twisted voice from out the original darkness, before the first light in the universe. And there are older legends that say he is the first collapsed star, a black hole grown complicated and sentient--his motivations unknowable, his power inexorable, a force of destruction unleashed upon existence itself.|Ranged|2|https://cdn.akamai.steamstatic.com/apps/dota2/images/dota_react/heroes/enigma.png|582|2.4|303|1.4|21|2.5|14|1.0|19|3.6|0|0|0|2|0|0|0|2|2|43|49|1.7|500|900|3.3|25|280|0.6|1800|800
facelessvoid|Faceless Void|Agility|Can freeze his enemies in time|Time is everything to Faceless Void. He speeds time to dash between locations, manipulates it to dodge attacks, stops it in a large area to devastate his foes, and given enough of it to gather resources, he can make himself unbelievably powerful.|Darkterror the Faceless Void is a visitor from Claszureme, a realm outside of time. It remains a mystery why this being from another dimension believes the struggle for the Nemesis Stones is worth entering our physical plane, but apparently an upset in the balance of power in this world has repercussions in adjacent dimensions. Time means nothing to Darkterror, except as a way to thwart his foes and aid his allies. His long-view of the cosmos has given him a remote, disconnected quality, although in battle he is quite capable of making it personal.|Melee|2|Darkterror the Faceless Void is a visitor from Claszureme, a realm outside of time. It remains a mystery why this being from another dimension believes the struggle for the Nemesis Stones is worth entering our physical plane, but apparently an upset in the balance of power in this world has repercussions in adjacent dimensions. Time means nothing to Darkterror, except as a way to thwart his foes and aid his allies. His long-view of the cosmos has given him a remote, disconnected quality, although in battle he is quite capable of making it personal.|Melee|2|https://cdn.akamai.steamstatic.com/apps/dota2/images/dota_react/heroes/faceless_void.png|560|3.0|255|0.8|20|2.6|21|3.3|15|1.5|2|0|0|2|0|1|1|0|3|58|64|1.7|150|900|3.5|25|300|0.9|1800|800
grimstroke|Grimstroke|Intelligence|Disables enemies with a swipe of his brush|Skilled at manipulating battle from the outskirts, Grimstroke studies every movement and assesses each line, deciding when to emerge from inky darkness to disable his victims and bind them together with a swipe of his brush. He delights in unleashing phantom thralls to vex opponents, as he carefully considers how to dispatch multiple enemies with one fateful stroke.|The people of Ashkavor crowded around the temple square, eager to witness the ascension of their new guardian -- to stand near the man as he bound their souls to his own. But as his final brush strokes fell against the runestone, and the bond of a new Ascended One was forged, everyone -- even those who'd stayed in their homes -- could sense that something had gone terribly wrong. He knew the cause instantly. The droplets of ichor he'd procured to amplify the potency of his inkpots had instead contaminated them, and the power of the binding spell he'd cast now threatened to consume him. An inky corruption snaked upward from the runestone, along the handle of his brush, soon overtaking his hands. From there it spread quickly. Once it overcame his face and his mouth, he couldn't have screamed even if he'd wanted to. All of his life he'd calculated on how to attain ever greater powers than the limits presented by his teachers would allow--going so far as to break the sacred prohibition against augmenting the inks. Indeed, with the wellspring of the Ascended bond open to him, he felt a measure of power coursing into his soul like he'd never imagined. His greatest triumph was upon him, if he could only survive it. He drew deep from the power of the bond, pushing back against the corrupted ink flow. A great moan filled the air -- the collective cry of his people. Some swayed on their feet. The weakest collapsed. Many tried to run. And still deeper he pulled from their bloodline reservoir. But it wasn't enough to stop the ink tide. It was only when the breath trapped in his lungs began to fail him, and the inkpool darkness fully encased him, that he saw his way out. The bond he'd made with the Ashkavoran people -- his people -- meant to be drawn upon only in service of their protection... It flowed two ways. With a final surge of strength -- this time directed by more than just blind repulsion -- he pushed the ink torrent into the bond itself. Slowly, he felt the tide retreat... and heard the awful wails of his people as the corruption in turn rolled over them. When at last the ink relented, his eyes opened upon a world changed. The Ashkavoran people as he knew them were gone. Every last soul was transformed into terrifying shades of their former selves -- comprised no longer of blood and bone, only viscid, tainted ink.|Ranged|2|The people of Ashkavor crowded around the temple square, eager to witness the ascension of their new guardian -- to stand near the man as he bound their souls to his own. But as his final brush strokes fell against the runestone, and the bond of a new Ascended One was forged, everyone -- even those who'd stayed in their homes -- could sense that something had gone terribly wrong. He knew the cause instantly. The droplets of ichor he'd procured to amplify the potency of his inkpots had instead contaminated them, and the power of the binding spell he'd cast now threatened to consume him. An inky corruption snaked upward from the runestone, along the handle of his brush, soon overtaking his hands. From there it spread quickly. Once it overcame his face and his mouth, he couldn't have screamed even if he'd wanted to. All of his life he'd calculated on how to attain ever greater powers than the limits presented by his teachers would allow--going so far as to break the sacred prohibition against augmenting the inks. Indeed, with the wellspring of the Ascended bond open to him, he felt a measure of power coursing into his soul like he'd never imagined. His greatest triumph was upon him, if he could only survive it. He drew deep from the power of the bond, pushing back against the corrupted ink flow. A great moan filled the air -- the collective cry of his people. Some swayed on their feet. The weakest collapsed. Many tried to run. And still deeper he pulled from their bloodline reservoir. But it wasn't enough to stop the ink tide. It was only when the breath trapped in his lungs began to fail him, and the inkpool darkness fully encased him, that he saw his way out. The bond he'd made with the Ashkavoran people -- his people -- meant to be drawn upon only in service of their protection... It flowed two ways. With a final surge of strength -- this time directed by more than just blind repulsion -- he pushed the ink torrent into the bond itself. Slowly, he felt the tide retreat... and heard the awful wails of his people as the corruption in turn rolled over them. When at last the ink relented, his eyes opened upon a world changed. The Ashkavoran people as he knew them were gone. Every last soul was transformed into terrifying shades of their former selves -- comprised no longer of blood and bone, only viscid, tainted ink.|Ranged|2|https://cdn.akamai.steamstatic.com/apps/dota2/images/dota_react/heroes/grimstroke.png|582|2.4|375|1.3|21|2.4|18|1.9|25|3.8|0|2|2|2|0|0|1|0|0|46|50|1.7|600|900|3.0|25|290|0.6|1800|800
gyrocopter|Gyrocopter|Agility|Barrages with his cannon and homing missiles|With his arsenal of firepower at the ready, Gyrocopter soars into battle. Blasting all nearby enemies with shots from his cannon or hammering them with a barrage of rockets, if he is able to gather his full strength, he demolishes foes with ease.|After serving through a lifetime of wars, upheaval, riots, and revolutions, the brass figured Aurel had seen enough. But in addition to a few trinkets and his considerable pension, the erstwhile engineer left with something far more interesting: a long-forgotten, incomplete schematic for a Gyrocopter, the world's first manned, non-magical flying device. Retiring to the tropical obscurity of the Ash Archipelago with little else but time and money, he set to work building the device.<br>As the years wore on and the remains of failed prototypes began to pile up, he began to wonder if mechanical flight was even possible. A decade and a day after his retirement, on a sunny afternoon with a southerly breeze, Aurel sat in his latest attempt bristling with indignation and expectant failure. With a grunt of effort he pulled the ignition cord and covered his head, waiting for the inevitable explosion. However to his great surprise he began to lift and, following a few panicked adjustments, stabilize. Within an hour, he was ducking and weaving with the breeze, level with the gulls, and Aurel found himself filled with the breathless wonder of flight.<br>As dusk settled in he set a course back to his workshop, but no sooner had he turned his craft when a cannonball tore through his tailfin. Disentangling himself from the wreckage, he swam toward the nearest piece of land in sight, and cursed to see the ship responsible for the cannonball collecting the debris. Days later, when Aurel returned to his workshop, he set to work on yet another gyrocopter, this one capable of carrying a much heavier, more dangerous payload.|Ranged|1|After serving through a lifetime of wars, upheaval, riots, and revolutions, the brass figured Aurel had seen enough. But in addition to a few trinkets and his considerable pension, the erstwhile engineer left with something far more interesting: a long-forgotten, incomplete schematic for a Gyrocopter, the world's first manned, non-magical flying device. Retiring to the tropical obscurity of the Ash Archipelago with little else but time and money, he set to work building the device.<br>As the years wore on and the remains of failed prototypes began to pile up, he began to wonder if mechanical flight was even possible. A decade and a day after his retirement, on a sunny afternoon with a southerly breeze, Aurel sat in his latest attempt bristling with indignation and expectant failure. With a grunt of effort he pulled the ignition cord and covered his head, waiting for the inevitable explosion. However to his great surprise he began to lift and, following a few panicked adjustments, stabilize. Within an hour, he was ducking and weaving with the breeze, level with the gulls, and Aurel found himself filled with the breathless wonder of flight.<br>As dusk settled in he set a course back to his workshop, but no sooner had he turned his craft when a cannonball tore through his tailfin. Disentangling himself from the wreckage, he swam toward the nearest piece of land in sight, and cursed to see the ship responsible for the cannonball collecting the debris. Days later, when Aurel returned to his workshop, he set to work on yet another gyrocopter, this one capable of carrying a much heavier, more dangerous payload.|Ranged|1|https://cdn.akamai.steamstatic.com/apps/dota2/images/dota_react/heroes/gyrocopter.png|604|2.5|327|1.1|22|2.5|25|3.2|21|2.4|3|0|1|1|0|0|0|0|0|43|49|1.7|365|3000|6.2|25|320|0.6|1800|800
hoodwink|Hoodwink|Agility|Shackles her enemies to trees|Always at hand when trouble's afoot, Hoodwink lives to tangle with the threats that fill the haunted forest she adopted as her home. Toting a massive crossbow while still able to scurry through the woodland with the greatest of ease, Hoodwink is nearly impossible to keep tabs on in battle. Lose track and she'll pop out behind you -- your stunned carcass already dangling in one of her nets.|Hoodwink's earliest years were spent in the idyllic expanse of green that once filled the edges of Krimwohl. But as that kingdom grew, and the needs of both her citizens and her armies became ravenous, rival ore and timber barons scratched and clawed to outpace each other in devouring the natural beauty of the border forests, gorging themselves to meet the demands of the changing land. To those living in the ancient timberlands, the choice came down to following the line of refugees into the pacified zones, falling to Krimwohl's black powder and steel while defending their homes, or fleeing further north to tempt fate in the haunted glens and groves of the misty Wood Tomo'kan. So it was in those treacherous northern mistwoods that Hoodwink came of age, dodging the horrific predators of the Tomo'kan, ingratiating herself with some of the local banditry whilst antagonizing others, and finding absolutely every which way to be underfoot whenever some interesting mischief arose--often allegedly the cause of it. But when the faintest whiff of Krimwohl's fires eventually drifted into her adopted home, Hoodwink's thoughts turned to any family and friends who might have survived the invasion--now made to eke out lives in the razed lands whose wounds scarred her very soul--and she couldn't help but approach the edges of civilization to get a glimpse of the devils that had destroyed her old life. There, she saw that the monsters from her childhood weren't monsters at all. They were just...people. Soldiers, laborers, merchants...and refugees. And the soldiers, even with their black powder and steel, were nothing compared to the dangers of the Tomo'kan--real dangers with tentacles and teeth--dangers she danced around like a twirling maple seed. Knowing she can always find safe passage in the tangles of the Tomo'kan, where most warm-blooded folk wisely fear to tread, Hoodwink now strikes out against those who dare try to further pacify the wilds, happily taking what she likes from their belongings, destroying what she has no use for, and helping guide any kindred survivors back to a life in the green once again.|Ranged|2|Hoodwink's earliest years were spent in the idyllic expanse of green that once filled the edges of Krimwohl. But as that kingdom grew, and the needs of both her citizens and her armies became ravenous, rival ore and timber barons scratched and clawed to outpace each other in devouring the natural beauty of the border forests, gorging themselves to meet the demands of the changing land. To those living in the ancient timberlands, the choice came down to following the line of refugees into the pacified zones, falling to Krimwohl's black powder and steel while defending their homes, or fleeing further north to tempt fate in the haunted glens and groves of the misty Wood Tomo'kan. So it was in those treacherous northern mistwoods that Hoodwink came of age, dodging the horrific predators of the Tomo'kan, ingratiating herself with some of the local banditry whilst antagonizing others, and finding absolutely every which way to be underfoot whenever some interesting mischief arose--often allegedly the cause of it. But when the faintest whiff of Krimwohl's fires eventually drifted into her adopted home, Hoodwink's thoughts turned to any family and friends who might have survived the invasion--now made to eke out lives in the razed lands whose wounds scarred her very soul--and she couldn't help but approach the edges of civilization to get a glimpse of the devils that had destroyed her old life. There, she saw that the monsters from her childhood weren't monsters at all. They were just...people. Soldiers, laborers, merchants...and refugees. And the soldiers, even with their black powder and steel, were nothing compared to the dangers of the Tomo'kan--real dangers with tentacles and teeth--dangers she danced around like a twirling maple seed. Knowing she can always find safe passage in the tangles of the Tomo'kan, where most warm-blooded folk wisely fear to tread, Hoodwink now strikes out against those who dare try to further pacify the wilds, happily taking what she likes from their belongings, destroying what she has no use for, and helping guide any kindred survivors back to a life in the green once again.|Ranged|2|https://cdn.akamai.steamstatic.com/apps/dota2/images/dota_react/heroes/hoodwink.png|494|1.9|327|1.1|17|2.0|25|3.6|21|2.9|0|2|2|1|0|0|2|0|0|47|54|2.0|575|1800|4.2|25|310|0.9|1800|800
