id|name|main_attribute|subtitle|lore|lore_extended|attack_type|complexity|lore_extended|attack_type|complexity|asset_portrait_url|base_health|health_regeneration|base_mana|mana_regeneration|base_strength|strength_gain|base_agility|agility_gain|base_intelligence|intelligence_gain|role_carry|role_support|role_nuker|role_disabler|role_jungler|role_durable|role_escape|role_pusher|role_initiator|base_attack_damage_min|base_attack_damage_max|base_attack_time|base_attack_range|base_attack_projectile_speed|base_defense_armor|base_defense_magic_resist_perc|base_mobility_movement_speed|base_mobility_turn_rate|base_mobility_vision_day|base_mobility_vision_night
abaddon|Abaddon|Universal|Shields his allies or himself from attacks|Able to transform enemy attacks into self-healing, Abaddon can survive almost any assault. Shielding allies and launching his double-edged coil at a friend or foe, he is always ready to ride into the thick of battle.|The Font of Avernus is the source of a family's strength, a crack in primal stones from which vapors of prophetic power have issued for generations. Each newborn of the cavernous House Avernus is bathed in the black mist, and by this baptism they are given an innate connection to the mystic energies of the land. They grow up believing themselves fierce protectors of their lineal traditions, the customs of the realm--but what they really are protecting is the Font itself. And the motives of the mist are unclear.<br>When the infant Abaddon was bathed in the Font, they say something went awry. In the child's eyes there flared a light of comprehension that startled all present and set the sacerdotes to whispering. He was raised with every expectation of following the path all scions of Avernus took--to train in war, that in times of need he might lead the family's army in defense of the ancestral lands. But Abaddon was always one apart. Where others trained with weapons, he bent himself to meditation in the presence of the mist. He drank deep from the vapors that welled from the Font, learning to blend his spirit with the potency that flowed from far beneath the House; he became a creature of the black mist.<br>There was bitterness within the House Avernus--elders and young alike accusing him of neglecting his responsibilities. But all such accusations stopped when Abaddon rode into battle, and they saw how the powers of the mist had given him mastery over life and death beyond those of any lord the House had ever known.|Melee|1|The Font of Avernus is the source of a family's strength, a crack in primal stones from which vapors of prophetic power have issued for generations. Each newborn of the cavernous House Avernus is bathed in the black mist, and by this baptism they are given an innate connection to the mystic energies of the land. They grow up believing themselves fierce protectors of their lineal traditions, the customs of the realm--but what they really are protecting is the Font itself. And the motives of the mist are unclear.<br>When the infant Abaddon was bathed in the Font, they say something went awry. In the child's eyes there flared a light of comprehension that startled all present and set the sacerdotes to whispering. He was raised with every expectation of following the path all scions of Avernus took--to train in war, that in times of need he might lead the family's army in defense of the ancestral lands. But Abaddon was always one apart. Where others trained with weapons, he bent himself to meditation in the presence of the mist. He drank deep from the vapors that welled from the Font, learning to blend his spirit with the potency that flowed from far beneath the House; he became a creature of the black mist.<br>There was bitterness within the House Avernus--elders and young alike accusing him of neglecting his responsibilities. But all such accusations stopped when Abaddon rode into battle, and they saw how the powers of the mist had given him mastery over life and death beyond those of any lord the House had ever known.|Melee|1|https://cdn.akamai.steamstatic.com/apps/dota2/images/dota_react/heroes/abaddon.png|604|3.2|291|0.9|22|2.6|23|1.5|18|2.0|1|2|0|0|0|2|0|0|0|50|60|1.5|150|900|2.8|25|325|0.6|1800|800
alchemist|Alchemist|Strength|Earns extra gold from unit kills and bounty runes|Synthesizing extra resources from each and every kill, Alchemist has no trouble gathering the tools needed to destroy his foes. Ambushing enemies with corrosive acid and a host of unstable chemicals, he battles to ensure his greedy escapades can remain uninterrupted.|The sacred science of Chymistry was a Darkbrew family tradition, but no Darkbrew had ever shown the kind of creativity, ambition, and recklessness of young Razzil. However, when adulthood came calling he pushed aside the family trade to try his hand at manufacturing gold through Alchemy.<br>In an act of audacity befitting his reputation, Razzil announced he would transmute an entire mountain into gold. Following two decades of research and spending and preparation, he failed spectacularly, quickly finding himself imprisoned for the widespread destruction his experiment wrought. Yet Razzil was never one to take a setback lightly, and sought escape to continue his research.<br>When his new cellmate turned out to be a fierce ogre, he found just the opportunity he needed. After convincing the ogre not to eat him, Razzil set about carefully concocting a tincture for it to drink, made from the moulds and mosses growing in the prison stone work. In a week's time, it seemed ready. When the ogre drank the potion, it flew into an unstoppable berserker rage, destroying the cell bars and exploding through walls and guards alike.<br>They soon found themselves lost somewhere in the forest surrounding the city with a trail of wreckage in their wake and no signs of pursuit. In the tonic's afterglow, the ogre seemed serene, happy, and even eager. Resolving to work together, the pair set off to collect the materials needed to attempt Razzil's Alchemic transmutation once more.|Melee|1|The sacred science of Chymistry was a Darkbrew family tradition, but no Darkbrew had ever shown the kind of creativity, ambition, and recklessness of young Razzil. However, when adulthood came calling he pushed aside the family trade to try his hand at manufacturing gold through Alchemy.<br>In an act of audacity befitting his reputation, Razzil announced he would transmute an entire mountain into gold. Following two decades of research and spending and preparation, he failed spectacularly, quickly finding himself imprisoned for the widespread destruction his experiment wrought. Yet Razzil was never one to take a setback lightly, and sought escape to continue his research.<br>When his new cellmate turned out to be a fierce ogre, he found just the opportunity he needed. After convincing the ogre not to eat him, Razzil set about carefully concocting a tincture for it to drink, made from the moulds and mosses growing in the prison stone work. In a week's time, it seemed ready. When the ogre drank the potion, it flew into an unstoppable berserker rage, destroying the cell bars and exploding through walls and guards alike.<br>They soon found themselves lost somewhere in the forest surrounding the city with a trail of wreckage in their wake and no signs of pursuit. In the tonic's afterglow, the ogre seemed serene, happy, and even eager. Resolving to work together, the pair set off to collect the materials needed to attempt Razzil's Alchemic transmutation once more.|Melee|1|https://cdn.akamai.steamstatic.com/apps/dota2/images/dota_react/heroes/alchemist.png|626|2.5|375|1.3|23|2.7|22|1.5|25|1.8|2|1|1|1|0|2|0|0|1|50|56|1.7|150|900|3.7|25|295|0.6|1800|800
ancientapparition|Ancient Apparition|Intelligence|Launches a powerful icy blast from anywhere on the map|Able to launch a powerful blast of damaging ice across the battlefield, Ancient Apparition threatens to shatter weakened enemies wherever they are. Slowing enemies as he enhances his allies' effectiveness in battle, he is a constant threat to his foes.|Kaldr, the Ancient Apparition, is an image projected from outside time. He springs from the cold, infinite void that both predates the universe and awaits its end. Kaldr is, Kaldr was, Kaldr shall be...and what we perceive, powerful as it appears to us, is but the faintest faded echo of the true, eternal Kaldr. Some believe that as the cosmos ages and approaches its final moments, the brightness and power of Kaldr will also intensify--that the Ancient Apparition will grow younger and stronger as eternity's end draws nigh. His grip of ice will bring all matter to a stop, his image will cast a light too terrible to behold. An Apparition no longer!|Ranged|2|Kaldr, the Ancient Apparition, is an image projected from outside time. He springs from the cold, infinite void that both predates the universe and awaits its end. Kaldr is, Kaldr was, Kaldr shall be...and what we perceive, powerful as it appears to us, is but the faintest faded echo of the true, eternal Kaldr. Some believe that as the cosmos ages and approaches its final moments, the brightness and power of Kaldr will also intensify--that the Ancient Apparition will grow younger and stronger as eternity's end draws nigh. His grip of ice will bring all matter to a stop, his image will cast a light too terrible to behold. An Apparition no longer!|Ranged|2|https://cdn.akamai.steamstatic.com/apps/dota2/images/dota_react/heroes/ancient_apparition.png|560|2.3|351|1.1|20|1.9|20|2.0|23|3.1|0|2|1|1|0|0|0|0|0|44|54|1.7|675|1250|2.3|25|285|0.6|1800|800
anti-mage|Anti-Mage|Agility|Slashes his foes with mana-draining attacks|Should Anti-Mage have the opportunity to gather his full strength, few can stop his assaults. Draining mana from enemies with every strike or teleporting short distances to escape an ambush, cornering him is a challenge for any foe.|The monks of Turstarkuri watched the rugged valleys below their mountain monastery as wave after wave of invaders swept through the lower kingdoms. Ascetic and pragmatic, in their remote monastic eyrie they remained aloof from mundane strife, wrapped in meditation that knew no gods or elements of magic. Then came the Legion of the Dead God, crusaders with a sinister mandate to replace all local worship with their Unliving Lord's poisonous nihilosophy. From a landscape that had known nothing but blood and battle for a thousand years, they tore the souls and bones of countless fallen legions and pitched them against Turstarkuri. The monastery stood scarcely a fortnight against the assault, and the few monks who bothered to surface from their meditations believed the invaders were but demonic visions sent to distract them from meditation. They died where they sat on their silken cushions. Only one youth survived--a pilgrim who had come as an acolyte, seeking wisdom, but had yet to be admitted to the monastery. He watched in horror as the monks to whom he had served tea and nettles were first slaughtered, then raised to join the ranks of the Dead God's priesthood. With nothing but a few of Turstarkuri's prized dogmatic scrolls, he crept away to the comparative safety of other lands, swearing to obliterate not only the Dead God's magic users--but to put an end to magic altogether.|Melee|1|The monks of Turstarkuri watched the rugged valleys below their mountain monastery as wave after wave of invaders swept through the lower kingdoms. Ascetic and pragmatic, in their remote monastic eyrie they remained aloof from mundane strife, wrapped in meditation that knew no gods or elements of magic. Then came the Legion of the Dead God, crusaders with a sinister mandate to replace all local worship with their Unliving Lord's poisonous nihilosophy. From a landscape that had known nothing but blood and battle for a thousand years, they tore the souls and bones of countless fallen legions and pitched them against Turstarkuri. The monastery stood scarcely a fortnight against the assault, and the few monks who bothered to surface from their meditations believed the invaders were but demonic visions sent to distract them from meditation. They died where they sat on their silken cushions. Only one youth survived--a pilgrim who had come as an acolyte, seeking wisdom, but had yet to be admitted to the monastery. He watched in horror as the monks to whom he had served tea and nettles were first slaughtered, then raised to join the ranks of the Dead God's priesthood. With nothing but a few of Turstarkuri's prized dogmatic scrolls, he crept away to the comparative safety of other lands, swearing to obliterate not only the Dead God's magic users--but to put an end to magic altogether.|Melee|1|https://cdn.akamai.steamstatic.com/apps/dota2/images/dota_react/heroes/antimage.png|582|3.1|219|0.6|21|1.6|24|2.8|12|1.8|3|0|1|0|0|0|3|0|0|53|57|1.4|150||5.0|25|310|0.6|1800|800
arcwarden|Arc Warden|Universal|Creates a copy of himself to split push|A splintered fragment of the same primordial power as the Ancients themselves, Zet the Arc Warden has pledged to see the clash between Radiant and Dire finally end. Assault lone enemies with fluxing energy, or distort space to generate a protective field around allies. Summon a Spark Wraith to patrol an area for enemies to infuse with harmful magic, then create a double of Zet, items and all, to overwhelm your foes.|Before the beginning of all, there existed a presence: a primordial mind, infinite, awesome, and set to inscrutable purpose. As the universe thundered into being, this mind was fragmented and scattered. Two among its greater fragments--who would come to be named Radiant and Dire--found themselves locked in vicious opposition, and began twisting all of creation to serve their conflict.<br>As war and cataclysm threatened the nascent cosmos, the will of a third fragment made itself known. Naming itself Zet, this intellect sought to resolve the disharmony and return all to perfect unity. Appalled by its kin's conflicting nature, Zet gathered the sum of its power. In a sudden flash, it overwhelmed its siblings, and fused the warring aspects into a stellar sphere before hurling them into the darkness to orbit a nondescript world. Harmony was restored, though only the barest fraction of Zet's strength remained. Setting its gaze on the prison, Zet chose to use its weakened power to serve as watchful warden until time's end. For uncounted aeons, this vigil stood.<br>Life flourished upon the world below, oblivious to the dangers imprisoned within the softly glowing moon, or of Zet's struggles to contain them. As the captives' eternal clash reverberated within, the surface of the prison shuddered, over time beginning to crack. Ultimately, Zet's depleted power proved insufficient to contain the breach, and at last the moon was shattered. The prison's ancient inhabitants had escaped to sow their conflict anew.<br>Flung to the farthest reaches by the prison's explosion, Zet was transformed by the dissonant energies of its former captives. No longer of single form and thought, its presence had become split among many--some lesser, some greater--each connected by a fleeting arc of consciousness. Struggling to suppress its own disunity, Zet sped toward the burgeoning conflict of its siblings, bending its fractured wills toward a singular conclusion: the aspects of the primordial mind must be made to reunite, or all must be destroyed lest the conflict spread further...|Ranged|3|Before the beginning of all, there existed a presence: a primordial mind, infinite, awesome, and set to inscrutable purpose. As the universe thundered into being, this mind was fragmented and scattered. Two among its greater fragments--who would come to be named Radiant and Dire--found themselves locked in vicious opposition, and began twisting all of creation to serve their conflict.<br>As war and cataclysm threatened the nascent cosmos, the will of a third fragment made itself known. Naming itself Zet, this intellect sought to resolve the disharmony and return all to perfect unity. Appalled by its kin's conflicting nature, Zet gathered the sum of its power. In a sudden flash, it overwhelmed its siblings, and fused the warring aspects into a stellar sphere before hurling them into the darkness to orbit a nondescript world. Harmony was restored, though only the barest fraction of Zet's strength remained. Setting its gaze on the prison, Zet chose to use its weakened power to serve as watchful warden until time's end. For uncounted aeons, this vigil stood.<br>Life flourished upon the world below, oblivious to the dangers imprisoned within the softly glowing moon, or of Zet's struggles to contain them. As the captives' eternal clash reverberated within, the surface of the prison shuddered, over time beginning to crack. Ultimately, Zet's depleted power proved insufficient to contain the breach, and at last the moon was shattered. The prison's ancient inhabitants had escaped to sow their conflict anew.<br>Flung to the farthest reaches by the prison's explosion, Zet was transformed by the dissonant energies of its former captives. No longer of single form and thought, its presence had become split among many--some lesser, some greater--each connected by a fleeting arc of consciousness. Struggling to suppress its own disunity, Zet sped toward the burgeoning conflict of its siblings, bending its fractured wills toward a singular conclusion: the aspects of the primordial mind must be made to reunite, or all must be destroyed lest the conflict spread further...|Ranged|3|https://cdn.akamai.steamstatic.com/apps/dota2/images/dota_react/heroes/arc_warden.png|560|2.3|363|1.2|20|2.4|20|3.0|24|2.6|3|0|1|0|0|0|3|0|0|51|57|1.7|625|900|3.3|25|285|0.7|1800|800
axe|Axe|Strength|Taunts and forces enemies to attack him|One after another, Axe cuts down his foes. Marching ahead of his team, he locks his enemies in battle then counters their blows with a deadly spin of his weapon. Slamming his culling blade through a weakened enemy, he is always charging onward.|As a grunt in the Army of Red Mist, Mogul Khan set his sights on the rank of Red Mist General. In battle after battle he proved his worth through gory deed. His rise through the ranks was helped by the fact that he never hesitated to decapitate a superior. Through the seven year Campaign of the Thousand Tarns, he distinguished himself in glorious carnage, his star of fame shining ever brighter, while the number of comrades in arms steadily dwindled. On the night of ultimate victory, Axe declared himself the new Red Mist General, and took on the ultimate title of 'Axe.' But his troops now numbered zero. Of course, many had died in battle, but a significant number had also fallen to Axe's blade. Needless to say, most soldiers now shun his leadership. But this matters not a whit to Axe, who knows that a one-man army is by far the best.|Melee|1|As a grunt in the Army of Red Mist, Mogul Khan set his sights on the rank of Red Mist General. In battle after battle he proved his worth through gory deed. His rise through the ranks was helped by the fact that he never hesitated to decapitate a superior. Through the seven year Campaign of the Thousand Tarns, he distinguished himself in glorious carnage, his star of fame shining ever brighter, while the number of comrades in arms steadily dwindled. On the night of ultimate victory, Axe declared himself the new Red Mist General, and took on the ultimate title of 'Axe.' But his troops now numbered zero. Of course, many had died in battle, but a significant number had also fallen to Axe's blade. Needless to say, most soldiers now shun his leadership. But this matters not a whit to Axe, who knows that a one-man army is by far the best.|Melee|1|https://cdn.akamai.steamstatic.com/apps/dota2/images/dota_react/heroes/axe.png|670|5.0|291|0.9|25|2.8|20|1.7|18|1.6|1|0|0|2|0|3|0|0|3|56|60|1.7|150|900|3.3|25|315|0.6|1800|800
bane|Bane|Universal|Puts his enemies to sleep, incapacitating them|Bane brings terror to his enemies with his arsenal of disabling abilities. Whether trapping a foe within a contagious nightmare, or gripping an enemy in place, he gives allies all the time they need to slay their enemy.|When the gods have nightmares, it is Bane Elemental who brings them. Also known as Atropos, Bane was born from the midnight terrors of the goddess Nyctasha. A force of terror too powerful to be contained by sleep, he surfaced from her slumbers, fed upon her immortality, and stole his vaporous form from her inky blood. He is the essence of fear. Mortals who hear his voice hear their darkest secrets whispered in their ear. He calls to the hidden fear in every Hero's heart. Wakefulness is no protection, for Bane's black blood, continuously dripping, is a tar that traps his enemies in nightmare. In the presence of Bane, every Hero remembers to fear the dark.|Ranged|2|When the gods have nightmares, it is Bane Elemental who brings them. Also known as Atropos, Bane was born from the midnight terrors of the goddess Nyctasha. A force of terror too powerful to be contained by sleep, he surfaced from her slumbers, fed upon her immortality, and stole his vaporous form from her inky blood. He is the essence of fear. Mortals who hear his voice hear their darkest secrets whispered in their ear. He calls to the hidden fear in every Hero's heart. Wakefulness is no protection, for Bane's black blood, continuously dripping, is a tar that traps his enemies in nightmare. In the presence of Bane, every Hero remembers to fear the dark.|Ranged|2|https://cdn.akamai.steamstatic.com/apps/dota2/images/dota_react/heroes/bane.png|626|2.5|351|1.1|23|2.7|23|2.7|23|2.7|0|2|1|3|0|1|0|0|0|55|61|1.7|400|900|4.8|25|305|0.6|1800|1200
batrider|Batrider|Universal|Can lasso an enemy away from his team|Once he takes to the skies, Batrider can strike from any direction. Snatching a foe with his lasso, he soars above the treetops, pulling his prey through a trail of flame as he drags them before his merciless allies.|There is no such thing as harmony among the creatures of the Yama Raskav Jungle. By bite, or claw, or pincer, or hoof, even the slightest sign of weakness means a swift death. They say the Rider was just a lad cutting chaff in his family's field when he was taken, swept up by a massive morde-bat looking for take-out. But this boy had a better idea, and wriggled his way from his captor's grip, onto the beast's back, and hacked it down with his tools. Emerging from the bloody wreckage and intoxicated by the thrill of flight, the boy realized he'd found his calling.<br>The boy grew, and every summer he'd return to his family's field, often setting out into the bush seeking to reclaim that first thrill of facing death in the form of jaws or a fatal fall. The years went on, but his fire only grew stronger. He studied the overgrowth, plunging deeper with each expedition, until finally he found his way to the caves at the heart of hostility. They say the Rider, on the eve of a scorching summer night, had nothing but a rope, a bottle of liquid courage and a burning determination to feel the skies once more, when he plunged inside...|Ranged|2|There is no such thing as harmony among the creatures of the Yama Raskav Jungle. By bite, or claw, or pincer, or hoof, even the slightest sign of weakness means a swift death. They say the Rider was just a lad cutting chaff in his family's field when he was taken, swept up by a massive morde-bat looking for take-out. But this boy had a better idea, and wriggled his way from his captor's grip, onto the beast's back, and hacked it down with his tools. Emerging from the bloody wreckage and intoxicated by the thrill of flight, the boy realized he'd found his calling.<br>The boy grew, and every summer he'd return to his family's field, often setting out into the bush seeking to reclaim that first thrill of facing death in the form of jaws or a fatal fall. The years went on, but his fire only grew stronger. He studied the overgrowth, plunging deeper with each expedition, until finally he found his way to the caves at the heart of hostility. They say the Rider, on the eve of a scorching summer night, had nothing but a rope, a bottle of liquid courage and a burning determination to feel the skies once more, when he plunged inside...|Ranged|2|https://cdn.akamai.steamstatic.com/apps/dota2/images/dota_react/heroes/batrider.png|626|4.0|339|1.1|23|2.9|15|1.8|22|2.9|0|0|0|2|0|0|1|0|3|39|43|1.7|400|900|4.5|25|330|0.9|1600|800
