id|name|main_attribute|subtitle|lore|lore_extended|attack_type|complexity|lore_extended|attack_type|complexity|asset_portrait_url|base_health|health_regeneration|base_mana|mana_regeneration|base_strength|strength_gain|base_agility|agility_gain|base_intelligence|intelligence_gain|role_carry|role_support|role_nuker|role_disabler|role_jungler|role_durable|role_escape|role_pusher|role_initiator|base_attack_damage_min|base_attack_damage_max|base_attack_time|base_attack_range|base_attack_projectile_speed|base_defense_armor|base_defense_magic_resist_perc|base_mobility_movement_speed|base_mobility_turn_rate|base_mobility_vision_day|base_mobility_vision_night
monkeyking|Monkey King|Agility|Springs from the cover of the tree tops|Always in search of a good fight, Monkey King travels atop the trees aiming to spring from leafy cover and surprise his enemies. Calling upon an army of monkey soldiers to overwhelm opponents, this agile trickster revels in the chaos of battle, ready to slam his legendary staff down on any hopes of escape.|For 500 years the mountain pressed down upon him, only his head free from the crushing weight of the stonewrought prison the elder gods had summoned to halt his childish rebellion. Moss grew along the lines of his exposed face, tufts of grass sprouted from his ears; his vision was framed in wildflowers reaching from the soil around his cheeks. Most thought him long dead, tormented by the gods for waging war against the heavens until naught but his legend survived. But, as the stories go, the Monkey King cannot die. So he waited. Until the gods came to offer a chance at absolution, he endured. And when they did come to name the price, Sun Wukong accepted their charge: he would accompany a young acolyte on a secret pilgrimage, protect him from demons and dangers of the road, and guide the man home in possession of a coveted relic. Do that, and humbly obey the human's commands in service to their holy mission, and Wukong would prove himself reformed. For a change, Sun Wukong fulfilled his oath to the gods with honor, and atoned for the sins of past insurrections. The acolyte, much learned in hardships, was returned to his home temple, relic in hand; and Wukong-finding himself for the first time in proper standing with any gods of consequence-was content for a short while to give up his old thirst for adventure and glory. But the Monkey King was born for mischief...and offending the gods never gets old.|Melee|2|For 500 years the mountain pressed down upon him, only his head free from the crushing weight of the stonewrought prison the elder gods had summoned to halt his childish rebellion. Moss grew along the lines of his exposed face, tufts of grass sprouted from his ears; his vision was framed in wildflowers reaching from the soil around his cheeks. Most thought him long dead, tormented by the gods for waging war against the heavens until naught but his legend survived. But, as the stories go, the Monkey King cannot die. So he waited. Until the gods came to offer a chance at absolution, he endured. And when they did come to name the price, Sun Wukong accepted their charge: he would accompany a young acolyte on a secret pilgrimage, protect him from demons and dangers of the road, and guide the man home in possession of a coveted relic. Do that, and humbly obey the human's commands in service to their holy mission, and Wukong would prove himself reformed. For a change, Sun Wukong fulfilled his oath to the gods with honor, and atoned for the sins of past insurrections. The acolyte, much learned in hardships, was returned to his home temple, relic in hand; and Wukong-finding himself for the first time in proper standing with any gods of consequence-was content for a short while to give up his old thirst for adventure and glory. But the Monkey King was born for mischief...and offending the gods never gets old.|Melee|2|https://cdn.akamai.steamstatic.com/apps/dota2/images/dota_react/heroes/monkey_king.png|538|2.9|315|1.0|19|2.8|24|3.7|20|1.8|2|0|0|1|0|0|2|0|1|53|57|1.7|300|900|6.0|25|300|0.6|1800|800
morphling|Morphling|Agility|Rides the waves to flank enemies|Shifting his attributes to suit his situation, Morphling can be as elusive as he is deadly. Whether riding a wave to flank an enemy, or boosting his health before escaping into his deceptive replication, few can hope to corner him.|For dark eons the comet circled. Held in thrall to a distant sun, bound by gravity's inexorable pull, the massive ball of ice careened through the blackness between worlds, made strange by its dark journey. On the eve of the ancient war of the Vloy, it punched down through the sky and lit a glowing trail across the night, a sign both armies took for an omen. The frozen ball melted in a flash of boiling heat, as below two forces enjoined in battle across the border of a narrow river. Thus freed from its icy stasis, the Morphling was born into conflict, an elemental power at one with the tides of the ocean, capricious and unconstrained. He entered the fight, instinctively taking the form of the first general who dared set foot across the water, and then struck him dead. As the motley warriors clashed, he shifted from form to form throughout the battle, instantly absorbing the ways of these strange creatures--now a footsoldier, now an archer, now the cavalryman--until, by the time the last soldier fell, Morphling had played every part. The battle's end was his beginning.|Ranged|3|For dark eons the comet circled. Held in thrall to a distant sun, bound by gravity's inexorable pull, the massive ball of ice careened through the blackness between worlds, made strange by its dark journey. On the eve of the ancient war of the Vloy, it punched down through the sky and lit a glowing trail across the night, a sign both armies took for an omen. The frozen ball melted in a flash of boiling heat, as below two forces enjoined in battle across the border of a narrow river. Thus freed from its icy stasis, the Morphling was born into conflict, an elemental power at one with the tides of the ocean, capricious and unconstrained. He entered the fight, instinctively taking the form of the first general who dared set foot across the water, and then struck him dead. As the motley warriors clashed, he shifted from form to form throughout the battle, instantly absorbing the ways of these strange creatures--now a footsoldier, now an archer, now the cavalryman--until, by the time the last soldier fell, Morphling had played every part. The battle's end was his beginning.|Ranged|3|https://cdn.akamai.steamstatic.com/apps/dota2/images/dota_react/heroes/morphling.png|626|2.8|303|1.4|23|3.2|24|3.9|19|1.8|3|0|1|1|0|2|3|0|0|36|45|1.5|350|1300|2.0|25|285|0.7|1800|800
muerta|Muerta|Intelligence|Blasts fearsome trickshots and unleashes ethereal ruin|Muerta is a master of death who stalks the lands of life, corralling targets with fearsome trickshots and summoning revenants to smother her foes. Always ready to pick off unwary targets with her spare gunhand, Muerta is at her most menacing when she crosses the veil of the dead to strike her enemies with the ethereal fury of the damned.|There are as many stories about Muerta as there are graves in the Carrion Fields of Gorm. Some tell their children ghost stories of a young peasant girl returned from the dead to punish the bandits who killed her family. Others, drunk in dark taverns, slur conspiracy theories about kidnappings and phantom guilds of killers. One constant bleeds through every tale: of a woman so consumed by hate for those who killed her that she refused to die. And of Death, so impressed by whatever hate-filled engine that drove this woman that he gave her Mercy and Grace  twin ethereal pistols  and made her his second in command. Now she hunts down wayward souls whose last grains have tumbled from their hourglass, and drags them kicking and screaming to their eternal reward.|Ranged|1|There are as many stories about Muerta as there are graves in the Carrion Fields of Gorm. Some tell their children ghost stories of a young peasant girl returned from the dead to punish the bandits who killed her family. Others, drunk in dark taverns, slur conspiracy theories about kidnappings and phantom guilds of killers. One constant bleeds through every tale: of a woman so consumed by hate for those who killed her that she refused to die. And of Death, so impressed by whatever hate-filled engine that drove this woman that he gave her Mercy and Grace  twin ethereal pistols  and made her his second in command. Now she hunts down wayward souls whose last grains have tumbled from their hourglass, and drags them kicking and screaming to their eternal reward.|Ranged|1|https://cdn.akamai.steamstatic.com/apps/dota2/images/dota_react/heroes/muerta.png|538|2.1|351|1.1|19|2.0|20|2.7|23|3.4|3|0|2|1|0|0|0|0|0|47|55|1.7|575|3000|3.3|25|295|0.7|1800|800
nagasiren|Naga Siren|Agility|Able to capitivate and disable enemies with her song|Sending squads of mirrored clones against her foes, Naga Siren ensnares and slays enemies as she leads her forces to victory. With the sound of her voice, she disables nearby foes to spring an ambush or crafting a hasty escape.|Among the high-sworn of the Slithereen Guard there is a solemn vow oft repeated before battle: No Slithereen may fail. In truth, these words are equal parts oath and enforceable covenant, for those who fall short of their duty are banished from the order. To fail is to be other than Slithereen.<br>Once most highly esteemed of her race, Slithice for many years commanded a battalion of her fellows, using her formidable voice as her greatest weapon. Powerful, sinuous, serpentine, she led her deadly Guard in defense of the Deep Ones, and the great wealth of the sunken cities. But in the final battle of Crey, her forces were driven back by a marauding army of levianths intent on finding tribute for their god Maelrawn. After the long and bloody onslaught, as the bodies were cleared from the sunken halls, a single jeweled chalice was found missing from the trove. Of her hundred Guard, only a handful survived, but their bravery and sacrifice were of little consequence. What mattered was that treasure was taken. Honor destroyed. And so Naga Siren was cast out. Banished to search for the stolen chalice. Though she might add a hundred times her weight to the golden trove, she is doomed to live apart until that day she returns that which was taken. For no amount of gold is equal in honor to the honor she lost.|Melee|2|Among the high-sworn of the Slithereen Guard there is a solemn vow oft repeated before battle: No Slithereen may fail. In truth, these words are equal parts oath and enforceable covenant, for those who fall short of their duty are banished from the order. To fail is to be other than Slithereen.<br>Once most highly esteemed of her race, Slithice for many years commanded a battalion of her fellows, using her formidable voice as her greatest weapon. Powerful, sinuous, serpentine, she led her deadly Guard in defense of the Deep Ones, and the great wealth of the sunken cities. But in the final battle of Crey, her forces were driven back by a marauding army of levianths intent on finding tribute for their god Maelrawn. After the long and bloody onslaught, as the bodies were cleared from the sunken halls, a single jeweled chalice was found missing from the trove. Of her hundred Guard, only a handful survived, but their bravery and sacrifice were of little consequence. What mattered was that treasure was taken. Honor destroyed. And so Naga Siren was cast out. Banished to search for the stolen chalice. Though she might add a hundred times her weight to the golden trove, she is doomed to live apart until that day she returns that which was taken. For no amount of gold is equal in honor to the honor she lost.|Melee|2|https://cdn.akamai.steamstatic.com/apps/dota2/images/dota_react/heroes/naga_siren.png|582|3.1|327|1.1|21|2.4|21|3.3|21|2.0|3|1|0|2|0|0|1|2|1|44|46|1.7|150|900|4.5|25|330|0.6|1800|800
nature'sprophet|Nature's Prophet|Universal|Able to teleport to any location on the map at will|Whether in the thick of battle or gathering resources for his next assault, Nature's Prophet seems to be everywhere. Teleporting at will to any location and instantly creating an army of violent trees to fight for him, he attacks where enemies least expect.|When Verodicia, Goddess of the Woods, had finished filling in the green places, having planted the coiled-up spirit in the seed, having lured the twining waters from deep within the rock, having sworn the sun its full attention to the growing things, she realized that her own time had reached its end, and like one of the leaves whose fate she had imprinted in the seed, she would fall without seeing the fruiting of her dream. It pained her to leave the world bereft, for the sprouts had not yet broken through the soil--and they would be tender and vulnerable to every sort of harm. She found in her seed pouch one last seed that she had missed in the sowing. She spoke a single word into the seed and swallowed it as she fell. Her vast body decomposed throughout the long winter, becoming the humus that would feed the seedlings in the spring. And on the morning of the vernal equinox, before the rest of the forest had begun to wake, that last seed ripened and burst in an instant. From it stepped Nature's Prophet, in full leaf, strong and wise, possessing Verodicia's power to foresee where he would be needed most in defense of the green places--and any who might be fortunate enough to call him an ally.|Ranged|2|When Verodicia, Goddess of the Woods, had finished filling in the green places, having planted the coiled-up spirit in the seed, having lured the twining waters from deep within the rock, having sworn the sun its full attention to the growing things, she realized that her own time had reached its end, and like one of the leaves whose fate she had imprinted in the seed, she would fall without seeing the fruiting of her dream. It pained her to leave the world bereft, for the sprouts had not yet broken through the soil--and they would be tender and vulnerable to every sort of harm. She found in her seed pouch one last seed that she had missed in the sowing. She spoke a single word into the seed and swallowed it as she fell. Her vast body decomposed throughout the long winter, becoming the humus that would feed the seedlings in the spring. And on the morning of the vernal equinox, before the rest of the forest had begun to wake, that last seed ripened and burst in an instant. From it stepped Nature's Prophet, in full leaf, strong and wise, possessing Verodicia's power to foresee where he would be needed most in defense of the green places--and any who might be fortunate enough to call him an ally.|Ranged|2|https://cdn.akamai.steamstatic.com/apps/dota2/images/dota_react/heroes/furion.png|538|2.1|339|1.1|19|2.6|14|3.2|22|3.5|1|0|1|0|0|0|1|3|0|40|50|1.5|620|1125|2.3|25|295|0.9|1800|800
necrophos|Necrophos|Intelligence|Damages enemies and heals allies simultaneously|Wherever Necrophos goes, enemies wither as allies thrive. Restoring health to his friends and harming enemies with each death pulse, once his very presence has eaten away at an enemy, he summons the reaper to lengthen their stay in the afterlife.|In a time of great plague, an obscure monk of dark inclinations, one Rotund'jere, found himself promoted to the rank of Cardinal by the swift death of all his superiors. While others of the order went out to succor the ill, the newly ordained cardinal secluded himself within the Cathedral of Rumusque, busily scheming to acquire the property of dying nobles, promising them spiritual rewards if they signed over their terrestrial domains. As the plague receded to a few stubborn pockets, his behavior came to the attention of the greater order, which found him guilty of heresy and sentenced him to serve in the plague ward, ensorcelled with spells that would ensure him a slow and lingering illness. But they had not counted on his natural immunity. Rotund'jere caught the pox, but instead of dying, found it feeding his power, transforming him into a veritable plague-mage, a Pope of Pestilence. Proclaiming himself Necrophos, he travels the world, spreading plague wherever he goes, and growing in terrible power with every village his pestilential presence obliterates.|Ranged|1|In a time of great plague, an obscure monk of dark inclinations, one Rotund'jere, found himself promoted to the rank of Cardinal by the swift death of all his superiors. While others of the order went out to succor the ill, the newly ordained cardinal secluded himself within the Cathedral of Rumusque, busily scheming to acquire the property of dying nobles, promising them spiritual rewards if they signed over their terrestrial domains. As the plague receded to a few stubborn pockets, his behavior came to the attention of the greater order, which found him guilty of heresy and sentenced him to serve in the plague ward, ensorcelled with spells that would ensure him a slow and lingering illness. But they had not counted on his natural immunity. Rotund'jere caught the pox, but instead of dying, found it feeding his power, transforming him into a veritable plague-mage, a Pope of Pestilence. Proclaiming himself Necrophos, he travels the world, spreading plague wherever he goes, and growing in terrible power with every village his pestilential presence obliterates.|Ranged|1|https://cdn.akamai.steamstatic.com/apps/dota2/images/dota_react/heroes/necrolyte.png|516|2.1|351|1.1|18|2.3|12|1.3|23|2.7|1|0|2|1|0|1|0|0|0|49|53|1.7|500|1200|4.0|25|280|0.6|1800|800
nightstalker|Night Stalker|Strength|Enpowered by the shadows of nightfall|Once the sun goes down, Night Stalker's hunt begins. Charging through the shadowy forests, he snares prey in a slowing void as he tears them to shreds. Should sunrise threaten to end his terror, he can darken the skies to extend his onslaught.|Of the Night Stalker, there is no history, only stories. There are ancient tales woven into the lore of every race and every culture, of an impossible time before sunlight and daytime, when night reigned alone and the world was covered with the creatures of darkness--creatures like Balanar the Night Stalker. <br>It is said that on the dawn of the First Day, all the night creatures perished. All, that is, save one. Evil's embodiment, Night Stalker delights in his malevolence. He created the primal role of the Night Terror, the Boogeyman, and as long as there have been younglings, his is the specter summoned to terrify them. This is a role he relishes; nor are these empty theatrics. He does indeed stalk the unwary, the defenseless, those who have strayed beyond the lighted paths or denied the warnings of their communities. Night Stalker serves as living proof that every child's worst nightmare....is true.|Melee|1|Of the Night Stalker, there is no history, only stories. There are ancient tales woven into the lore of every race and every culture, of an impossible time before sunlight and daytime, when night reigned alone and the world was covered with the creatures of darkness--creatures like Balanar the Night Stalker. <br>It is said that on the dawn of the First Day, all the night creatures perished. All, that is, save one. Evil's embodiment, Night Stalker delights in his malevolence. He created the primal role of the Night Terror, the Boogeyman, and as long as there have been younglings, his is the specter summoned to terrify them. This is a role he relishes; nor are these empty theatrics. He does indeed stalk the unwary, the defenseless, those who have strayed beyond the lighted paths or denied the warnings of their communities. Night Stalker serves as living proof that every child's worst nightmare....is true.|Melee|1|https://cdn.akamai.steamstatic.com/apps/dota2/images/dota_react/heroes/night_stalker.png|626|3.8|255|1.0|23|3.0|18|2.2|15|1.6|1|0|1|2|0|2|0|0|2|63|67|1.7|150|900|5.0|25|295|0.6|800|1800
nyxassassin|Nyx Assassin|Universal|Reflects enemy damage and stuns|Nyx Assassin is always hunting for fragile targets. Sneaking invisibly through the forest, when he spots his prey, he swipes them with his deadly claws and impales them on stunning spikes, then reverses any counterattack with his reflecting carapace.|Deep in the Archive of Ultimyr, shelved between scholarly treatises on dragon cladistics and books of untranslatable spells, there is an ancient tome of entomological curiosities. Compiled by scholars, the book describes the telepathic talents of the zealot scarab, a strange species of social insect with abilities unique to all the seven planes.  <br>Unlike most grubs of his colony, Nyx Assassin did not arise from metamorphosis with the plodding thoughts and blunted appendages common to the worker caste of his kind. For his was a special transformation, guided by the grace of Nyx. He was the chosen one, selected from the many and anointed with an extract of the queen goddess herself. Not all survive the dark blessing of the queen's chamber, but he emerged with a penetrating mind, and dagger-like claws--his razor sharp mandibles raking the air while his thoughts projected directly into the minds of those around him. Of all zealot scarabs, he alone was selected for the highest calling. After his metamorphosis, he was reborn, by grace of Nyx, with abilities which shaped him for one thing and one thing only: to kill in the name of his goddess.|Melee|2|Deep in the Archive of Ultimyr, shelved between scholarly treatises on dragon cladistics and books of untranslatable spells, there is an ancient tome of entomological curiosities. Compiled by scholars, the book describes the telepathic talents of the zealot scarab, a strange species of social insect with abilities unique to all the seven planes.  <br>Unlike most grubs of his colony, Nyx Assassin did not arise from metamorphosis with the plodding thoughts and blunted appendages common to the worker caste of his kind. For his was a special transformation, guided by the grace of Nyx. He was the chosen one, selected from the many and anointed with an extract of the queen goddess herself. Not all survive the dark blessing of the queen's chamber, but he emerged with a penetrating mind, and dagger-like claws--his razor sharp mandibles raking the air while his thoughts projected directly into the minds of those around him. Of all zealot scarabs, he alone was selected for the highest calling. After his metamorphosis, he was reborn, by grace of Nyx, with abilities which shaped him for one thing and one thing only: to kill in the name of his goddess.|Melee|2|https://cdn.akamai.steamstatic.com/apps/dota2/images/dota_react/heroes/nyx_assassin.png|494|3.7|327|1.1|17|2.7|18|2.9|21|2.6|0|0|2|2|0|0|1|0|2|51|55|1.7|150|900|4.0|25|310|0.6|1800|800
ogremagi|Ogre Magi|Strength|Uses a touch of luck to amplify his skills|With a chance to multiply the outcome of each spell they cast, a bit of luck is all Ogre Magi needs to burn enemies to cinder, or boost the power of his allies. Of course, luck can be difficult to rely upon...|The ordinary ogre is the creature for whom the phrase 'As dumb as a bag of rock hammers' was coined. In his natural state, an ogre is supremely incapable of doing or deciding anything. Clothed in dirt, he sometimes finds himself accidentally draped in animal skins after eating lanekill. Not an especially social creature, he is most often found affectionately consorting with the boulders or tree-stumps he has mistaken for kin (a factor that may explain the ogre's low rate of reproduction). However, once every generation or so, the ogre race is blessed with the birth of a two-headed Ogre Magi, who is immediately given the traditional name of Aggron Stonebreak, the name of the first and perhaps only wise ogre in their line's history.<br>With two heads, Ogre Magi finds it possible to function at a level most other creatures manage with one. And while the Ogre Magi will win no debates (even with itself), it is graced with a divine quality known as Dumb Luck--a propensity for serendipitous strokes of fortune which have allowed the ogre race to flourish in spite of enemies, harsh weather, and an inability to feed itself. It's as if the Goddess of Luck, filled with pity for the sadly inept species, has taken Ogre Magi under her wing. And who could blame her? Poor things.|Melee|1|The ordinary ogre is the creature for whom the phrase 'As dumb as a bag of rock hammers' was coined. In his natural state, an ogre is supremely incapable of doing or deciding anything. Clothed in dirt, he sometimes finds himself accidentally draped in animal skins after eating lanekill. Not an especially social creature, he is most often found affectionately consorting with the boulders or tree-stumps he has mistaken for kin (a factor that may explain the ogre's low rate of reproduction). However, once every generation or so, the ogre race is blessed with the birth of a two-headed Ogre Magi, who is immediately given the traditional name of Aggron Stonebreak, the name of the first and perhaps only wise ogre in their line's history.<br>With two heads, Ogre Magi finds it possible to function at a level most other creatures manage with one. And while the Ogre Magi will win no debates (even with itself), it is graced with a divine quality known as Dumb Luck--a propensity for serendipitous strokes of fortune which have allowed the ogre race to flourish in spite of enemies, harsh weather, and an inability to feed itself. It's as if the Goddess of Luck, filled with pity for the sadly inept species, has taken Ogre Magi under her wing. And who could blame her? Poor things.|Melee|1|https://cdn.akamai.steamstatic.com/apps/dota2/images/dota_react/heroes/ogre_magi.png|626|3.8|120|0.0|23|4.2|14|1.5|0|0.0|0|2|2|2|0|1|0|0|1|67|73|1.7|150|900|6.3|25|290|0.6|1800|800
