asset_video|asset_icon|name|shard_scepter|description|info|modifiers|cooldown|mana|lore|hero_id
https://cdn.steamstatic.com/apps/dota2/videos/dota_react/abilities/luna/luna_lucent_beam|https://cdn.steamstatic.com/apps/dota2/images/dota_react/abilities/luna_lucent_beam.png|LUCENT BEAM||Calls a beam of lunar energy down upon an enemy, damaging and briefly stunning them.|ABILITY:Unit Target;AFFECTS:Enemy Units;DAMAGE TYPE:Magical;PIERCES SPELL IMMUNITY:No;DISPELLABLE:Only Strong Dispels;|BEAM DAMAGE:75/150/225/300;STUN DURATION:0.6;DAMAGE BUFF DURATION:0;DAMAGE BUFF PER BEAM:0/0/0/0;|9/8/7/6|90/100/110/120|Selemene smites those who encroach upon the Nightsilver Woods.|luna
https://cdn.steamstatic.com/apps/dota2/videos/dota_react/abilities/luna/luna_lunar_orbit|https://cdn.steamstatic.com/apps/dota2/images/dota_react/abilities/luna_lunar_orbit.png|LUNAR ORBIT||Creates 4 glaives that rotate 250 radius around Luna. Any enemy unit that collides with a glaive will take a percentage of Luna's Attack Damage.|ABILITY:No Target;DAMAGE TYPE:Physical;PIERCES SPELL IMMUNITY:Yes;DISPELLABLE:No;|DURATION:5/6/7/8;COLLISION RADIUS:175;COLLISION DAMAGE:22%/28%/34%/40%;DAMAGE REDUCTION:0%/0%/0%/0%;|40/35/30/25|65/70/75/80|None may approach Selemene's chosen without favor from the goddess herself.|luna
https://cdn.steamstatic.com/apps/dota2/videos/dota_react/abilities/luna/luna_eclipse|https://cdn.steamstatic.com/apps/dota2/images/dota_react/abilities/luna_eclipse.png|ECLIPSE||Showers random nearby enemies with strikes from Luna's current level of Lucent Beam. These beams do not stun their targets, and there is a maximum number of times that a single target can be struck. Also turns day into night for a short time.|ABILITY:No Target;AFFECTS:Allied Units;DAMAGE TYPE:Magical;PIERCES SPELL IMMUNITY:No;DISPELLABLE:No;|TOTAL BEAMS:6/9/12;RADIUS:675;MAX BEAMS PER UNIT:5;NIGHT DURATION:10;ECLIPSE DURATION:2.4/4.2/6;|105|150/200/250|In times of great need, Selemene herself descends into the world, blocking out the light and hope of the opposed.|luna
https://cdn.steamstatic.com/apps/dota2/videos/dota_react/abilities/luna/luna_aghanims_shard|https://cdn.steamstatic.com/apps/dota2/images/dota_react/abilities/luna_lunar_orbit.png|LUNAR ORBIT|SHARD ABILITY UPGRADE|Increases collision damage. Glaives rotate 50% faster.||||||luna
https://cdn.steamstatic.com/apps/dota2/videos/dota_react/abilities/luna/luna_aghanims_scepter|https://cdn.steamstatic.com/apps/dota2/images/dota_react/abilities/luna_eclipse.png|ECLIPSE|SCEPTER ABILITY UPGRADE|Allows Luna to cast Eclipse on an allied unit or herself and have its effects follow them, or cast it on an area. Increases total beams, reduces duration, removes the limit on beams per unit, and makes the beams appear twice as fast.|||105|150/200/250|In times of great need, Selemene herself descends into the world, blocking out the light and hope of the opposed.|luna
https://cdn.steamstatic.com/apps/dota2/videos/dota_react/abilities/lycan/lycan_summon_wolves|https://cdn.steamstatic.com/apps/dota2/images/dota_react/abilities/lycan_summon_wolves.png|SUMMON WOLVES||Summons 2 wolves to aid Lycan in battle. At level 3, wolves gain Permanent Invisibility, and at level 4 wolves gain Cripple that gives 20% chance to cripple the target, causing 8 damage per second and lose 60 attack speed for 4 seconds.|ABILITY:No Target;|DURATION:50;BASE ATTACK TIME:1.2/1.1/1/0.9/0.9/0.9;DAMAGE:23/29/35/41/47/53;HP:325/375/425/475/525/575;WOLF COUNT:2;BONUS HEALTH PER WOLF:0/0/0/0;BASE DAMAGE INCREASE PER WOLF:0/0/0/0;|30/30/30/30|115/120/125/130/130/130|The very enchantment that twisted his being also summons canine familiars.|lycan
https://cdn.steamstatic.com/apps/dota2/videos/dota_react/abilities/lycan/lycan_howl|https://cdn.steamstatic.com/apps/dota2/images/dota_react/abilities/lycan_howl.png|HOWL||Strikes fear into enemies, reducing armor and attack damage of all enemies within 2000 range of Lycan and his wolves. At night, Howl's armor and attack damage reductions are global.|ABILITY:No Target;PIERCES SPELL IMMUNITY:No;DISPELLABLE:Yes;|DURATION:8;ATTACK DAMAGE REDUCTION:25%/30%/35%/40%;ARMOR REDUCTION:4/5/6/7;|22/20/18/16|40|Blood-curdling wolf cries signal to opponents that Banehallow is among them.|lycan
https://cdn.steamstatic.com/apps/dota2/videos/dota_react/abilities/lycan/lycan_shapeshift|https://cdn.steamstatic.com/apps/dota2/images/dota_react/abilities/lycan_shapeshift.png|SHAPESHIFT||Lycan assumes his lupine form, granting him critical strikes and added vision at night. During Shapeshift, Lycan moves at increased speed and cannot be slowed.|ABILITY:No Target;DISPELLABLE:No;|DURATION:25;SHAPESHIFT MOVE SPEED:550;BONUS NIGHT VISION:1000;TRANSFORM TIME:1.1;CRITICAL CHANCE:40%;CRITICAL DAMAGE:160%/200%/240%;HEALTH BONUS:250/350/450;|110/100/90|100|Forever a slave to his lycanthropy, Banehallow has come to accept his curse, and embrace his own savagery.|lycan
https://cdn.steamstatic.com/apps/dota2/videos/dota_react/abilities/lycan/lycan_aghanims_shard|https://cdn.steamstatic.com/apps/dota2/images/dota_react/abilities/lycan_summon_wolves.png|SUMMON WOLVES|SHARD ABILITY UPGRADE|Causes one of your creep waves to include one uncontrollable wolf that moves with the wave. Additionally, wolves spawned this way may Cripple towers.||||||lycan
https://cdn.steamstatic.com/apps/dota2/videos/dota_react/abilities/lycan/lycan_aghanims_scepter|https://cdn.steamstatic.com/apps/dota2/images/dota_react/abilities/lycan_wolf_bite.png|WOLF BITE|SCEPTER GRANTS NEW ABILITY|Lycan bites an allied hero or creep-hero, granting them Shapeshift properties. Lycan and the bitten target gain 40% Lifesteal and share the healing effect of Lifesteal with each other as long as they are within 1200 range of each other.|ABILITY:Unit Target;AFFECTS:Allied Heroes;PIERCES SPELL IMMUNITY:Yes;DISPELLABLE:No;||110/100/90|150|Does this bite look infected?|lycan
https://cdn.steamstatic.com/apps/dota2/videos/dota_react/abilities/magnataur/magnataur_shockwave|https://cdn.steamstatic.com/apps/dota2/images/dota_react/abilities/magnataur_shockwave.png|SHOCKWAVE||Magnus sends out a wave of force, damaging enemy units in a line, pulling them towards him, and slowing them for a brief period.|ABILITY:Unit Target;AFFECTS:Enemy Units;DAMAGE TYPE:Magical;PIERCES SPELL IMMUNITY:No;|DAMAGE:75/150/225/300/300;MOVEMENT SLOW:75%;SLOW DURATION:0.4/0.6/0.8/1/1;DISTANCE:1200;|13/12/11/10|85/90/95/100|Mt. Joerlak was a somewhat unstable mass, and Magnus has learned to channel its reverberations.|magnus
https://cdn.steamstatic.com/apps/dota2/videos/dota_react/abilities/magnataur/magnataur_empower|https://cdn.steamstatic.com/apps/dota2/images/dota_react/abilities/magnataur_empower.png|EMPOWER||Gives an allied unit bonus damage and cleave on attack. Magnus receives 30% larger bonus.|ABILITY:Unit Target;AFFECTS:Allied Units;PIERCES SPELL IMMUNITY:Yes;DISPELLABLE:Yes;|DURATION:30/33/36/39;BONUS DAMAGE:16%/24%/32%/40%;CLEAVE DAMAGE:16%/24%/32%/40%;|8|45/55/65/75|With a deep bellow, Magnus displays his true power.|magnus
https://cdn.steamstatic.com/apps/dota2/videos/dota_react/abilities/magnataur/magnataur_skewer|https://cdn.steamstatic.com/apps/dota2/images/dota_react/abilities/magnataur_skewer.png|SKEWER||Magnus rushes forward, goring enemy units on his massive tusk. Heroes hit on the way will be dragged to the destination, then damaged and affected by slowed movement speed. The damage is increased based on distance traveled.|ABILITY:Point Target;DAMAGE TYPE:Magical;PIERCES SPELL IMMUNITY:No;DISPELLABLE:Yes;|SPEED:900;DISTANCE:800/900/1000/1100;SLOW:20%/30%/40%/50%;SLOW DURATION:3.25;DAMAGE:80/160/240/320;DISTANCE AS DAMAGE:6%/9%/12%/15%;TREE HIT DAMAGE:0;CLIFF HIT DAMAGE:0;|22/20/18/16|80/80/80/80|Magnoceros horns are valuable in direct proportion to their danger to prospective merchants.|magnus
https://cdn.steamstatic.com/apps/dota2/videos/dota_react/abilities/magnataur/magnataur_reverse_polarity|https://cdn.steamstatic.com/apps/dota2/images/dota_react/abilities/magnataur_reverse_polarity.png|REVERSE POLARITY||Magnus changes properties of matter, pulling all nearby enemies in front of him and stunning them with a damaging slam.|ABILITY:No Target;DAMAGE TYPE:Magical;PIERCES SPELL IMMUNITY:Yes;DISPELLABLE:Only Strong Dispels;|PULL RADIUS:430;DAMAGE:100/200/300;STUN DURATION:2.5/3/3.5;|120|150/225/300|Magnus fights with the fury of the erupting Mt. Joerlak.|magnus
https://cdn.steamstatic.com/apps/dota2/videos/dota_react/abilities/magnataur/magnataur_aghanims_shard|https://cdn.steamstatic.com/apps/dota2/images/dota_react/abilities/magnataur_skewer.png|SKEWER|SHARD ABILITY UPGRADE|Increases range and deals additional damage when skewering enemies into trees or cliffs.||||||magnus
https://cdn.steamstatic.com/apps/dota2/videos/dota_react/abilities/magnataur/magnataur_aghanims_scepter|https://cdn.steamstatic.com/apps/dota2/images/dota_react/abilities/magnataur_horn_toss.png|HORN TOSS|SCEPTER GRANTS NEW ABILITY|Magnus tosses any enemies in front of him, launching them to his rear. Enemies take damage, spend 0.6 seconds in the air, and are stunned while in the air and an additional amount of time after landing.|ABILITY:No Target;AFFECTS:Enemy Units;DAMAGE TYPE:Magical;PIERCES SPELL IMMUNITY:No;DISPELLABLE:Yes;|DAMAGE:300;AIR DURATION:0.6;STUN DURATION:0.75;|30|100|Survivors of Joerlak will never forget the sight of Magnus tossing countless enemies into rivers of fire and clouds of ash.|magnus
https://cdn.steamstatic.com/apps/dota2/videos/dota_react/abilities/marci/marci_grapple|https://cdn.steamstatic.com/apps/dota2/images/dota_react/abilities/marci_grapple.png|DISPOSE||Marci grabs an allied or enemy target and throws it effortlessly behind her, damaging and slowing the unit if it's an enemy. Any enemy units in the landing area will also be damaged and slowed.|ABILITY:Unit Target;AFFECTS:Heroes;DAMAGE TYPE:Magical;PIERCES SPELL IMMUNITY:No;DISPELLABLE:Yes;|THROW DISTANCE:250;SLOW DURATION:3;IMPACT DAMAGE:60/150/240/330;MOVEMENT SLOW:20%/30%/40%/50%;|16/14/12/10|80|Marci excels at removing obstacles from Princess Mirana's path.|marci
https://cdn.steamstatic.com/apps/dota2/videos/dota_react/abilities/marci/marci_companion_run|https://cdn.steamstatic.com/apps/dota2/images/dota_react/abilities/marci_companion_run.png|REBOUND||Marci bounds to the targeted allied unit, choosing a direction and distance she will spring away from it. Upon reaching the unit, Marci lunges to her final destination, damaging and stunning enemies where she lands.<br><br>The ally receives 15% bonus movement speed for 4s.|ABILITY:Unit Target;AFFECTS:Allied Units;DAMAGE TYPE:Magical;PIERCES SPELL IMMUNITY:No;DISPELLABLE:Only Strong Dispels;|CAST / JUMP RANGE:450/550/650/750;IMPACT DAMAGE:75/150/225/300;STUN DURATION:0.8/1.1/1.4/1.7;|24/20/16/12|70/80/90/100|With a friendly or brazen boost, Marci can find her way into the midst of any fight.|marci
https://cdn.steamstatic.com/apps/dota2/videos/dota_react/abilities/marci/marci_bodyguard|https://cdn.steamstatic.com/apps/dota2/images/dota_react/abilities/marci_bodyguard.png|BODYGUARD||Passively grants Marci lifesteal and bonus attack damage.<br><br>Marci protects an allied hero. For 6s, the ally also gains 75% of lifesteal and attack damage bonus. Whenever the ally attacks or is attacked by an enemy, Marci counter-attacks that target if they are within her attack range plus 125.|ABILITY:Unit Target;AFFECTS:Allied Heroes;DAMAGE TYPE:Physical;PIERCES SPELL IMMUNITY:Yes;DISPELLABLE:No;|LIFESTEAL:12%/18%/24%/30%;BONUS BASE ATTACK DAMAGE:12%/18%/24%/30%;|20|50|Marci learned at a young age that the best asset in a scrap is a steady companion.|marci
https://cdn.steamstatic.com/apps/dota2/videos/dota_react/abilities/marci/marci_unleash|https://cdn.steamstatic.com/apps/dota2/images/dota_react/abilities/marci_unleash.png|UNLEASH||Marci taps a hidden power, gaining Fury charges that allow her to deliver a rapid sequence of strikes that slow movement and attack speed of the target for 2s. The last strike in every Fury combo creates a damaging pulse around the target. In between Fury combos, Marci is unable to attack for 1.5s.<br><br>Marci gains 15% movement speed when Unleash is cast.|ABILITY:No Target;DAMAGE TYPE:Magical;DISPELLABLE:No;|DURATION:16;STRIKES PER FURY:5;BONUS ATTACK SPEED:700/975/1325;PULSE RADIUS:800;PULSE DAMAGE:50/100/150;MOVEMENT SLOW:30%;BASE ATTACK SPEED SLOW:60/80/100;|90/75/60|100/125/150|Though some have sought to understand its origins, Marci rebuffs all attempts to divine the source of her power.|marci
https://cdn.steamstatic.com/apps/dota2/videos/dota_react/abilities/marci/marci_aghanims_shard|https://cdn.steamstatic.com/apps/dota2/images/dota_react/abilities/marci_companion_run.png|REBOUND|SHARD ABILITY UPGRADE|Increases damage. Rebound can be cast on enemies, and causes Marci to also get the speed boost when she casts it.||||||marci
https://cdn.steamstatic.com/apps/dota2/videos/dota_react/abilities/marci/marci_aghanims_scepter|https://cdn.steamstatic.com/apps/dota2/images/dota_react/abilities/marci_unleash.png|UNLEASH|SCEPTER ABILITY UPGRADE|Reduces Unleash cooldown by 10 seconds and causes Unleash to apply a basic dispel on Marci. While Unleash is Active, all of Marci's abilities unleash pulses when cast. All of Marci's unleash pulses will silence units for 1 seconds.<br><br>DISPEL TYPE: Basic Dispel|||90/75/60|100/125/150|Though some have sought to understand its origins, Marci rebuffs all attempts to divine the source of her power.|marci
https://cdn.steamstatic.com/apps/dota2/videos/dota_react/abilities/mars/mars_spear|https://cdn.steamstatic.com/apps/dota2/images/dota_react/abilities/mars_spear.png|SPEAR OF MARS||Mars throws his legendary Spear with deadly precision, damaging each enemy unit it strikes. The first enemy hero it hits is skewered on the spear, pushing it back. If a skewered hero hits a tree, building, or cliff, they will be impaled to it and stunned.|ABILITY:Point Target;AFFECTS:Enemy Units;DAMAGE TYPE:Magical;PIERCES SPELL IMMUNITY:No;DISPELLABLE:Only Strong Dispels;|DAMAGE:100/175/250/325;CAST RANGE:900/1000/1100/1200;STUN DURATION:1.3/1.6/1.9/2.2;TRAIL DURATION:0;TRAIL RADIUS:0;DAMAGE PER SECOND:0;MOVEMENT SLOW:0%;DEBUFF LINGER DURATION:0;|14/13/12/11|100/110/120/130|The legendary Spear of Mars still glows with the heat of the forge god's fires.|mars
https://cdn.steamstatic.com/apps/dota2/videos/dota_react/abilities/mars/mars_gods_rebuke|https://cdn.steamstatic.com/apps/dota2/images/dota_react/abilities/mars_gods_rebuke.png|GOD'S REBUKE||Mars smashes enemies in front of him with his shield, knocking them back and damaging them with a critical hit based on his attack. Bonus damage is added when hitting heroes. Has True Strike.|ABILITY:Point Target;AFFECTS:Enemy Units;DAMAGE TYPE:Physical;|CRITICAL DAMAGE:150%/200%/250%/300%;DISTANCE:500;KNOCKBACK SLOW:40%;KNOCKBACK SLOW DURATION:2.5;BONUS DAMAGE VS HEROES:10/15/20/25;|16/14/12/10|90|There isn't a warrior alive who can stand unmoved by the sting of Mars' rebuke.|mars
https://cdn.steamstatic.com/apps/dota2/videos/dota_react/abilities/mars/mars_arena_of_blood|https://cdn.steamstatic.com/apps/dota2/images/dota_react/abilities/mars_arena_of_blood.png|ARENA OF BLOOD||After a short formation time, Mars summons an arena lined with the undead warriors of the Ash Legion, who block enemy attacks and movement. Enemy heroes near the inside edge of the arena will be attacked by spears, dealing damage and knocking them back.|ABILITY:Point Target;AFFECTS:Enemy Units;DAMAGE TYPE:Magical;PIERCES SPELL IMMUNITY:No;|DURATION:5/6/7;RADIUS:550;SPEAR DAMAGE:80/160/240;FORMATION TIME:0.1;|100/95/90|150/200/250|The long-dead members of the Ash Legion, assembled from the finest warriors to ever test the might of Mars, still revel in the thrill of combat, gladly beholden to the hand that fell them for as long as he so commands.|mars
https://cdn.steamstatic.com/apps/dota2/videos/dota_react/abilities/mars/mars_aghanims_shard|https://cdn.steamstatic.com/apps/dota2/images/dota_react/abilities/mars_spear.png|SPEAR OF MARS|SHARD ABILITY UPGRADE|Spear of Mars impales up to 1 heroes and leaves a fire trail behind that deals damage over time and slows movement speed.||||||mars
https://cdn.steamstatic.com/apps/dota2/videos/dota_react/abilities/medusa/medusa_mystic_snake|https://cdn.steamstatic.com/apps/dota2/images/dota_react/abilities/medusa_mystic_snake.png|MYSTIC SNAKE||A mystic snake made of energy jumps from target to target dealing damage. Damage and speed increases with each jump. After it reaches its last target, it returns to Medusa to replenish her with mana. The snake returns a percentage of the targets' total mana.|ABILITY:Unit Target;AFFECTS:Enemy Units;DAMAGE TYPE:Magical;PIERCES SPELL IMMUNITY:No;|JUMP RADIUS:450;JUMPS:3/4/5/6;BASE DAMAGE:90/140/190/240;MANA GAIN:15%;DAMAGE/SPEED INCREASE PER JUMP:25%;|15/14/13/12|80/100/120/140|The Gorgon's curse is her greatest strength.|medusa
https://cdn.steamstatic.com/apps/dota2/videos/dota_react/abilities/medusa/medusa_gorgon_grasp|https://cdn.steamstatic.com/apps/dota2/images/dota_react/abilities/medusa_gorgon_grasp.png|GORGON'S GRASP||Medusa fires arrows in a line that land in 3 groups, with each grouping larger than the previous. Enemies struck by a volley of arrows take an initial burst of damage and then are rooted, cannot turn, are revealed to the enemy, and take damage per second.|ABILITY:Point Target;DAMAGE TYPE:Physical;PIERCES SPELL IMMUNITY:No;DISPELLABLE:Yes;|INITIAL RADIUS:150;RADIUS GROWTH:50;DELAY:1;DURATION:0.8/1.2/1.6/2;DAMAGE:30/70/110/150;DAMAGE PER SECOND:100;|30/27/24/21|65/85/105/125|The best predators don't even need to pounce.|medusa
https://cdn.steamstatic.com/apps/dota2/videos/dota_react/abilities/medusa/medusa_stone_gaze|https://cdn.steamstatic.com/apps/dota2/images/dota_react/abilities/medusa_stone_gaze.png|STONE GAZE||Any enemy units looking at Medusa will have their movement and attack speed slowed. If 2 seconds of total time is accumulated looking at Medusa while Stone Gaze is active, that unit will turn to stone. Petrified units are stunned, and take bonus physical attack damage.|ABILITY:No Target;PIERCES SPELL IMMUNITY:Yes;DISPELLABLE:No;|RADIUS:1200;DURATION:5/5.5/6;SLOW:35%;STONE DURATION:2/2.2/2.4;BONUS PHYSICAL ATTACK DAMAGE:35%/45%/55%;SPEED BOOST:50%;|90|250|The beauty of Medusa is legendary.|medusa
https://cdn.steamstatic.com/apps/dota2/videos/dota_react/abilities/medusa/medusa_aghanims_shard|https://cdn.steamstatic.com/apps/dota2/images/dota_react/abilities/medusa_cold_blooded.png|COLD BLOODED|SHARD GRANTS NEW ABILITY|When Medusa is targeted with a spell, a single-target Mystic Snake is sent back towards the enemy that turns them into stone for 1s.|ABILITY:Passive;AFFECTS:Enemy Units;DAMAGE TYPE:Magical;PIERCES SPELL IMMUNITY:No;||12|0|Point your gaze at her if you dare.|medusa
https://cdn.steamstatic.com/apps/dota2/videos/dota_react/abilities/meepo/meepo_earthbind|https://cdn.steamstatic.com/apps/dota2/images/dota_react/abilities/meepo_earthbind.png|EARTHBIND||Tosses a net at the target point, rooting down all enemy units in an area around it.|ABILITY:Point Target;PIERCES SPELL IMMUNITY:No;DISPELLABLE:Yes;|DURATION:2;RADIUS:220;|16/14/12/10|70/80/90/100|Catching dinner in the Riftshadow Ruins can be quite the task.|meepo
https://cdn.steamstatic.com/apps/dota2/videos/dota_react/abilities/meepo/meepo_poof|https://cdn.steamstatic.com/apps/dota2/images/dota_react/abilities/meepo_poof.png|POOF||Drawing mystical energies from the earth, a Meepo can teleport to another Meepo or itself after channeling for 1.5 seconds, damaging the enemy in both the departure and arrival locations. <br><br>If the ability is in alt-cast state, all Meepos will also cast Poof to the target. When cast on the ground, all Meepos except the selected one will Poof to the closest location.|ABILITY:Unit Target;AFFECTS:Allied Heroes;DAMAGE TYPE:Magical;PIERCES SPELL IMMUNITY:No;|RADIUS:400;DAMAGE:50/80/110/140;|12/10/8/6|80|Sometimes breaking one of the Riftshadow Crystals can be just the trick for getting yourself out of a bind. Or your other self.|meepo
https://cdn.steamstatic.com/apps/dota2/videos/dota_react/abilities/meepo/meepo_aghanims_shard|https://cdn.steamstatic.com/apps/dota2/images/dota_react/abilities/meepo_petrify.png|DIG|SHARD GRANTS NEW ABILITY|Digs into the ground for a short duration, dispelling Meepo and causing him to become invulnerable and untargetable for 3s. Restores 25% of his max health over that duration.<br><br>DISPEL TYPE: Basic Dispel|ABILITY:No Target;PIERCES SPELL IMMUNITY:Yes;DISPELLABLE:No;|DURATION:3;MAX HP RESTORE:25%;|40|125|I'm diggin' here!|meepo
https://cdn.steamstatic.com/apps/dota2/videos/dota_react/abilities/meepo/meepo_aghanims_scepter|https://cdn.steamstatic.com/apps/dota2/images/dota_react/abilities/meepo_megameepo.png|MEGAMEEPO|SCEPTER GRANTS NEW ABILITY|Primary Meepo mounts all other Meepos in a 600 radius around him on top of his shoulders. While in this form, he gains 40% of the other Meepo stats and can Fling them at enemies, dealing damage and slowing them.<br><br>When cast, Earthbind generates additional nets and Poof deals bonus damage based on the amount of Meepos riding on top.|ABILITY:No Target;DISPELLABLE:No;|DURATION:25;|60|0|Hi, Meepos!|meepo
https://cdn.steamstatic.com/apps/dota2/videos/dota_react/abilities/mirana/mirana_starfall|https://cdn.steamstatic.com/apps/dota2/images/dota_react/abilities/mirana_starfall.png|STARSTORM||Calls down a wave of meteors to damage nearby enemy units. The closest enemy unit to Mirana in a 675 radius will be struck a second time.|ABILITY:No Target;DAMAGE TYPE:Magical;PIERCES SPELL IMMUNITY:No;|DAMAGE:75/150/225/300;SECOND METEOR DAMAGE:60%;RADIUS:675;BLIND MISS RATE:0%;BLIND DURATION:0;|12/12/12/12|80/90/100/110|The Goddess breaks the strata to empower her Princess in the time of need.|mirana
https://cdn.steamstatic.com/apps/dota2/videos/dota_react/abilities/mirana/mirana_arrow|https://cdn.steamstatic.com/apps/dota2/images/dota_react/abilities/mirana_arrow.png|SACRED ARROW||Fires a long-range arrow with deadly precision, which stuns and damages the first enemy unit it strikes. The stun duration ranges from 0.01 to 2.6 seconds, with bonus damage up to 180 added, based on the distance the arrow travels to its target. Instantly kills the first non-ancient creep it hits.|ABILITY:Point Target;DAMAGE TYPE:Magical;PIERCES SPELL IMMUNITY:No;DISPELLABLE:Only Strong Dispels;|DAMAGE:60/150/240/330;RANGE:3000;MINIMUM STUN:0.01;MAXIMUM STUN:2.6/3.4/4.2/5;MAXIMUM BONUS DAMAGE:180;SEARCH RADIUS:0;PRIMARY HIT STARSTORM DAMAGE:0%;|19/18/17/16|90|Lunar energies make the Princess of the Moon's arrows more deadly than most.|mirana
https://cdn.steamstatic.com/apps/dota2/videos/dota_react/abilities/mirana/mirana_leap|https://cdn.steamstatic.com/apps/dota2/images/dota_react/abilities/mirana_leap.png|LEAP||Mirana leaps forward into battle, empowering herself with a ferocious roar that grants bonus attack and movement speed. Speed bonus lasts 5 seconds.|ABILITY:No Target;DISPELLABLE:Yes;|DISTANCE:650;MOVEMENT BONUS:6%/12%/18%/24%;ATTACK SPEED BONUS:25/50/75/100;|0|50|None can fail to recognize Mirana's iconic white beast in the heat of battle.|mirana
https://cdn.steamstatic.com/apps/dota2/videos/dota_react/abilities/mirana/mirana_invis|https://cdn.steamstatic.com/apps/dota2/images/dota_react/abilities/mirana_invis.png|MOONLIGHT SHADOW||Turns Mirana and all allied heroes invisible and grants bonus movement speed. Mirana gains bonus outgoing damage during the duration. If a hero is revealed, invisibility will restore after the fade delay as long as Moonlight Shadow's duration has not expired.|ABILITY:No Target;PIERCES SPELL IMMUNITY:Yes;DISPELLABLE:No;|FADE DELAY:2.5/2/1.5;DURATION:18;MOVEMENT SPEED:9%/12%/15%;SELF OUTGOING DAMAGE BONUS:9%/12%/15%;|140/120/100|125|Her tenure with Selemene allows Mirana to eclipse the ground, wrapping her allies in a cloak of shadows.|mirana
https://cdn.steamstatic.com/apps/dota2/videos/dota_react/abilities/mirana/mirana_aghanims_shard|https://cdn.steamstatic.com/apps/dota2/images/dota_react/abilities/mirana_leap.png|LEAP|SHARD ABILITY UPGRADE|Grants +1 Leap charge. Attacks during the Leap buff critically strike for 150% damage.||||||mirana
https://cdn.steamstatic.com/apps/dota2/videos/dota_react/abilities/mirana/mirana_aghanims_scepter|https://cdn.steamstatic.com/apps/dota2/images/dota_react/abilities/mirana_arrow.png|SACRED ARROW|SCEPTER ABILITY UPGRADE|Causes Sacred Arrow to release a Starstorm on enemies along the travel path of the primary arrow, releasing a second Starstorm that deals less damage to the impacted unit.|||19/18/17/16|90|Lunar energies make the Princess of the Moon's arrows more deadly than most.|mirana
https://cdn.steamstatic.com/apps/dota2/videos/dota_react/abilities/monkey_king/monkey_king_boundless_strike|https://cdn.steamstatic.com/apps/dota2/images/dota_react/abilities/monkey_king_boundless_strike.png|BOUNDLESS STRIKE||Monkey King enlarges his staff and slams it against the ground, stunning enemies in a line and damaging them with bonus damage and a critical hit based on his attack. Has True Strike.|ABILITY:Point Target;AFFECTS:Enemy Units;DAMAGE TYPE:Physical;PIERCES SPELL IMMUNITY:No;DISPELLABLE:Only Strong Dispels;|STUN DURATION:0.7/0.9/1.1/1.3;CRITICAL DAMAGE:120%/140%/160%/180%;BONUS DAMAGE:20/40/60/80;DISTANCE:1100;|24/21/18/15|85/90/95/100|The legendary Jingu Bang grows to match its master's will, ensuring no enemy can escape the Monkey King's reach.|monkeyking
