asset_video|asset_icon|name|shard_scepter|description|info|modifiers|cooldown|mana|lore|hero_id
https://cdn.steamstatic.com/apps/dota2/videos/dota_react/abilities/silencer/silencer_global_silence|https://cdn.steamstatic.com/apps/dota2/images/dota_react/abilities/silencer_global_silence.png|GLOBAL SILENCE||Silencer stops all sound, preventing enemy heroes and units on the map from casting spells.|ABILITY:No Target;PIERCES SPELL IMMUNITY:Yes;DISPELLABLE:Yes;|FIRST DURATION:0/0/0;SECOND DURATION:0/0/0;DURATION:4.5/5.25/6;|120|300/450/600|With a shock to the ground, all magic and sound pauses, and Nortrom fulfills his prophecy.|silencer
https://cdn.steamstatic.com/apps/dota2/videos/dota_react/abilities/silencer/silencer_aghanims_scepter|https://cdn.steamstatic.com/apps/dota2/images/dota_react/abilities/silencer_global_silence.png|GLOBAL SILENCE|SCEPTER ABILITY UPGRADE|Global Silence applies Arcane Curse to heroes for the duration of Global Silence.|||120|300/450/600|With a shock to the ground, all magic and sound pauses, and Nortrom fulfills his prophecy.|silencer
https://cdn.steamstatic.com/apps/dota2/videos/dota_react/abilities/skywrath_mage/skywrath_mage_arcane_bolt|https://cdn.steamstatic.com/apps/dota2/images/dota_react/abilities/skywrath_mage_arcane_bolt.png|ARCANE BOLT||Skywrath Mage launches a slow-moving bolt of arcane magic, dealing damage to an enemy unit based on Skywrath Mage's intelligence.|ABILITY:Unit Target;AFFECTS:Enemy Units;DAMAGE TYPE:Magical;PIERCES SPELL IMMUNITY:No;|BASE DAMAGE:60/90/120/150;INT DAMAGE MULTIPLIER:1.5;|5/4/3/2|70|Within the Ghastly Eyrie's endless intrigue, only the clever and calm can hope to survive.|skywrathmage
https://cdn.steamstatic.com/apps/dota2/videos/dota_react/abilities/skywrath_mage/skywrath_mage_concussive_shot|https://cdn.steamstatic.com/apps/dota2/images/dota_react/abilities/skywrath_mage_concussive_shot.png|CONCUSSIVE SHOT||Skywrath Mage sets off a long range shot that hits the closest hero within a long range. Upon impact, it deals damage and slows in an area of effect.|ABILITY:No Target;DAMAGE TYPE:Magical;PIERCES SPELL IMMUNITY:No;DISPELLABLE:Yes;|SHOT RANGE:1600;DAMAGE RADIUS:250;DAMAGE:120/180/240/300;SLOW DURATION:4;SLOW:40%;|15/14/13/12|80/85/90/95|Those who serve the court of the Ghastly Eyrie are ever locked in covert war. One must always know where danger lurks nearest.|skywrathmage
https://cdn.steamstatic.com/apps/dota2/videos/dota_react/abilities/skywrath_mage/skywrath_mage_ancient_seal|https://cdn.steamstatic.com/apps/dota2/images/dota_react/abilities/skywrath_mage_ancient_seal.png|ANCIENT SEAL||Skywrath Mage seals the targeted unit with an ancient rune, silencing it and causing it to take additional damage from spells.|ABILITY:Unit Target;AFFECTS:Enemy Units;PIERCES SPELL IMMUNITY:No;DISPELLABLE:Yes;|INCREASED MAGIC DAMAGE:-20%/-25%/-30%/-35%;DURATION:3/4/5/6;|14|80/90/100/110|A holy incantation, whosoever finds themselves touched by Avilliva's sigil must suffer in penitent silence.|skywrathmage
https://cdn.steamstatic.com/apps/dota2/videos/dota_react/abilities/skywrath_mage/skywrath_mage_mystic_flare|https://cdn.steamstatic.com/apps/dota2/images/dota_react/abilities/skywrath_mage_mystic_flare.png|MYSTIC FLARE||Skywrath Mage uses his ultimate magical ability to conjure a precise and violent mystical field that lays waste to his adversaries. Deals massive damage distributed evenly among any Heroes in the area over 2 seconds.|ABILITY:Point Target;DAMAGE TYPE:Magical;PIERCES SPELL IMMUNITY:No;|RADIUS:170;DURATION:2;DAMAGE:800/1200/1600;|60/40/20|300/550/800|Only the most practiced of Skywrath sorcerers could hope to shape the skies into such a storm.|skywrathmage
https://cdn.steamstatic.com/apps/dota2/videos/dota_react/abilities/skywrath_mage/skywrath_mage_aghanims_shard|https://cdn.steamstatic.com/apps/dota2/images/dota_react/abilities/skywrath_mage_arcane_bolt.png|ARCANE BOLT|SHARD ABILITY UPGRADE|When Skywrath Mage casts Arcane Bolt, 2 bolts are created, one aimed at the original target, and two others aimed at random enemies within 500 range of the original target. Heroes will take priority.||||||skywrathmage
https://cdn.steamstatic.com/apps/dota2/videos/dota_react/abilities/skywrath_mage/skywrath_mage_aghanims_scepter|https://cdn.steamstatic.com/apps/dota2/images/dota_react/abilities/skywrath_mage_concussive_shot.png|CONCUSSIVE SHOT|SCEPTER ABILITY UPGRADE|When Skywrath Mage casts Concussive Shot, a different random target within 500 range of the original target will be hit with the same ability. Heroes will take priority.|||15/14/13/12|80/85/90/95|Those who serve the court of the Ghastly Eyrie are ever locked in covert war. One must always know where danger lurks nearest.|skywrathmage
https://cdn.steamstatic.com/apps/dota2/videos/dota_react/abilities/slardar/slardar_sprint|https://cdn.steamstatic.com/apps/dota2/images/dota_react/abilities/slardar_sprint.png|GUARDIAN SPRINT||Slardar slithers ahead, moving significantly faster and passing through units.|ABILITY:No Target;DISPELLABLE:Yes;|BONUS MOVE SPEED:10%/18%/26%/34%;DURATION:10;SPEED BURST MOVE SPEED:0%;SPEED BURST DURATION:0;SLOW RESISTANCE:0%;|29/25/21/17|25|As Slardar has made the transition from the Deeps, it has been necessary to use his powerful tail for sprinting instead of swimming.|slardar
https://cdn.steamstatic.com/apps/dota2/videos/dota_react/abilities/slardar/slardar_slithereen_crush|https://cdn.steamstatic.com/apps/dota2/images/dota_react/abilities/slardar_slithereen_crush.png|SLITHEREEN CRUSH||Slams the ground, leaving a puddle of water, and stunning and damaging nearby enemy units. After the stun, the affected units are slowed.|ABILITY:No Target;DAMAGE TYPE:Physical;PIERCES SPELL IMMUNITY:No;DISPELLABLE:Only Strong Dispels;|RADIUS:325;MOVEMENT SLOW:-20%/-25%/-30%/-35%;ATTACK SLOW:-20/-25/-30/-35;SLOW DURATION:3/4/5/6;STUN DURATION:0.8;PUDDLE DURATION:7;PUDDLE RADIUS:250;DAMAGE:75/150/225/300;HAZE DURATION:0;|7|100|A swift crush of might and water breaks even the toughest of defenses.|slardar
https://cdn.steamstatic.com/apps/dota2/videos/dota_react/abilities/slardar/slardar_amplify_damage|https://cdn.steamstatic.com/apps/dota2/images/dota_react/abilities/slardar_amplify_damage.png|CORROSIVE HAZE||Reduces enemy armor to amplify physical damage and provides True Sight and vision of the targeted unit, revealing invisibility. The enemy unit leaves a trail of water behind it.|ABILITY:Unit Target;AFFECTS:Enemy Units;PIERCES SPELL IMMUNITY:Yes;DISPELLABLE:Yes;|ARMOR REDUCTION:-10/-15/-20;DURATION:18;TRAIL RADIUS:100;TRAIL DURATION:7;|5|25|Even the strongest armor counts for little when left to the brine of the sea.|slardar
https://cdn.steamstatic.com/apps/dota2/videos/dota_react/abilities/slardar/slardar_aghanims_shard|https://cdn.steamstatic.com/apps/dota2/images/dota_react/abilities/slardar_slithereen_crush.png|SLITHEREEN CRUSH|SHARD ABILITY UPGRADE|Slithereen Crush now applies Corrosive Haze for a short time to units affected.||||||slardar
https://cdn.steamstatic.com/apps/dota2/videos/dota_react/abilities/slark/slark_dark_pact|https://cdn.steamstatic.com/apps/dota2/images/dota_react/abilities/slark_dark_pact.png|DARK PACT||After a short delay, Slark sacrifices some of his life blood, purging most negative debuffs and dealing damage to enemy units around him and to himself. Slark only takes 30% of the damage.<br><br>DISPEL TYPE: Strong Dispel|ABILITY:No Target;DAMAGE TYPE:Magical;PIERCES SPELL IMMUNITY:No;|DELAY:1.5;RADIUS:325;DAMAGE:75/150/225/300;|9/8/7/6|65|Slithereen are capable of quickly regrowing appendages, in case of critical injury, to save their own lives.|slark
https://cdn.steamstatic.com/apps/dota2/videos/dota_react/abilities/slark/slark_pounce|https://cdn.steamstatic.com/apps/dota2/images/dota_react/abilities/slark_pounce.png|POUNCE||Slark leaps forward, leashing the first hero he connects. That unit can only move a limited distance away from Slark's landing position.|ABILITY:No Target;DAMAGE TYPE:Magical;PIERCES SPELL IMMUNITY:No;DISPELLABLE:No;|DISTANCE:700;LEASH DURATION:2.5/2.75/3/3.25;LEASH RADIUS:400;CHARGES:0;BASE CHARGE RESTORE TIME:0;DISTANCE:0;ESSENCE SHIFT STACKS:0/0/0/0;|24/20/16/12|75/75/75/75|Time in the Dark Reef made Slark a dangerous assassin; aggressive and fearless.|slark
https://cdn.steamstatic.com/apps/dota2/videos/dota_react/abilities/slark/slark_shadow_dance|https://cdn.steamstatic.com/apps/dota2/images/dota_react/abilities/slark_shadow_dance.png|SHADOW DANCE||When used, Slark hides himself in a cloud of shadows, becoming immune to detection. Attacking, casting spells, and using items will not reveal Slark.|ABILITY:No Target;DISPELLABLE:No;|DURATION:4/4.25/4.5;|50/40/30|100|The hidden Thirteenth is a slippery foe.|slark
https://cdn.steamstatic.com/apps/dota2/videos/dota_react/abilities/slark/slark_aghanims_shard|https://cdn.steamstatic.com/apps/dota2/images/dota_react/abilities/slark_depth_shroud.png|DEPTH SHROUD|SHARD GRANTS NEW ABILITY|Creates a cloud at the target location. All allies inside the radius are hidden and affected by Shadow Dance.|ABILITY:Point Target;|DURATION:3;RADIUS:225;|75|75|Nothing worse than a job going bad thanks to some clompy-footed friend.|slark
https://cdn.steamstatic.com/apps/dota2/videos/dota_react/abilities/slark/slark_aghanims_scepter|https://cdn.steamstatic.com/apps/dota2/images/dota_react/abilities/slark_pounce.png|POUNCE|SCEPTER ABILITY UPGRADE|Provides charges and increases range.|||24/20/16/12|75/75/75/75|Time in the Dark Reef made Slark a dangerous assassin; aggressive and fearless.|slark
https://cdn.steamstatic.com/apps/dota2/videos/dota_react/abilities/snapfire/snapfire_scatterblast|https://cdn.steamstatic.com/apps/dota2/images/dota_react/abilities/snapfire_scatterblast.png|SCATTERBLAST||Snapfire unloads with a wide blast that damages and slows enemies in a cone. Damage, Movement Slow, Attack Slow and Slow Duration are increased by 50% for enemies caught at point-blank range.|ABILITY:Point Target;AFFECTS:Enemy Units;DAMAGE TYPE:Magical;PIERCES SPELL IMMUNITY:No;DISPELLABLE:Yes;|DAMAGE:100/160/220/280;SLOW DURATION:1;MOVEMENT SLOW:100%;ATTACK SLOW:100;POINT-BLANK RANGE:450;|18/15/12/9|85/90/95/100|A favorite from her collection, Beadie crafted Ol' Rackatee as her first line of defense when she ventured into the Outlands.|snapfire
https://cdn.steamstatic.com/apps/dota2/videos/dota_react/abilities/snapfire/snapfire_firesnap_cookie|https://cdn.steamstatic.com/apps/dota2/images/dota_react/abilities/snapfire_firesnap_cookie.png|FIRESNAP COOKIE||Snapfire feeds a potent cookie to Mortimer or an ally, causing them to hop a short distance. The hopping unit stuns and damages enemies in the landing zone.|ABILITY:Unit Target;AFFECTS:Allied Units;DAMAGE TYPE:Magical;DISPELLABLE:Only Strong Dispels;|HOP DISTANCE:425;IMPACT RADIUS:300;IMPACT DAMAGE:75/150/225/300;IMPACT STUN DURATION:1/1.4/1.8/2.2;HEAL AMOUNT:0;|18/17/16/15|85/90/95/100|With the help of a secret mixture that pairs Beadie's baking skills with her passion for black powder, these battle biscuits pack a punch.|snapfire
https://cdn.steamstatic.com/apps/dota2/videos/dota_react/abilities/snapfire/snapfire_lil_shredder|https://cdn.steamstatic.com/apps/dota2/images/dota_react/abilities/snapfire_lil_shredder.png|LIL' SHREDDER||Snapfire heats up her mounted turret to rapidly fire 5 attacks dealing fixed damage plus a percentage of her attack damage. Each attack reduces the enemy's armor. Provides bonus attack range for the duration.|ABILITY:No Target;DAMAGE TYPE:Physical;|BASE DAMAGE PER SHOT:25/40/55/70;ATTACK DAMAGE:35%;BONUS RANGE:160/240/320/400;ARMOR LOSS PER STACK:0.5;ARMOR LOSS DURATION:5;|24/20/16/12|70/80/90/100|Beadie constantly tinkers with a design she first dreamed up plotting an exodus from her old gang.|snapfire
https://cdn.steamstatic.com/apps/dota2/videos/dota_react/abilities/snapfire/snapfire_mortimer_kisses|https://cdn.steamstatic.com/apps/dota2/images/dota_react/abilities/snapfire_mortimer_kisses.png|MORTIMER KISSES||Snapfire's friend launches a barrage of firespit globs over 5.5 seconds. Globs cause impact damage and create pools of firespit, which slow and apply damage over time. Snapfire has a reduced turn rate for the duration and a minimum launch range of 600. Each glob can be targeted with a right click.|ABILITY:Point Target;AFFECTS:Enemy Units;DAMAGE TYPE:Magical;PIERCES SPELL IMMUNITY:No;DISPELLABLE:Yes;|GLOB COUNT:8;IMPACT RADIUS:275;DAMAGE PER GLOB:180/270/360;BURN DPS:60/80/100;ENEMY MOVEMENT SLOW:15%/20%/25%;FIRESPIT POOL DURATION:3.5;|120/110/100|125/150/175|Little did Beadie know when she adopted Mortimer, dragon toads--which aren't even toads at all--share more than just a name with their distant draconic cousins.|snapfire
https://cdn.steamstatic.com/apps/dota2/videos/dota_react/abilities/snapfire/snapfire_aghanims_shard|https://cdn.steamstatic.com/apps/dota2/images/dota_react/abilities/snapfire_firesnap_cookie.png|FIRESNAP COOKIE|SHARD ABILITY UPGRADE|Firesnap cookies become even more potent, healing the target and launching a Mortimer Kiss that does 50% impact damage to the landing destination.||||||snapfire
https://cdn.steamstatic.com/apps/dota2/videos/dota_react/abilities/snapfire/snapfire_aghanims_scepter|https://cdn.steamstatic.com/apps/dota2/images/dota_react/abilities/snapfire_gobble_up.png|GOBBLE UP|SCEPTER GRANTS NEW ABILITY|Mortimer gobbles up a creep or an allied hero, which he can then spit towards enemies. The unit stays in his belly up to 0 seconds.|ABILITY:Unit Target;||40|120|SHLORP!|snapfire
https://cdn.steamstatic.com/apps/dota2/videos/dota_react/abilities/sniper/sniper_shrapnel|https://cdn.steamstatic.com/apps/dota2/images/dota_react/abilities/sniper_shrapnel.png|SHRAPNEL||Consumes a charge to launch a ball of shrapnel that showers the target area in explosive pellets. Enemies are subject to damage and slowed movement. Reveals the targeted area. Shrapnel charges restore every 35 seconds.|ABILITY:Point Target;DAMAGE TYPE:Magical;PIERCES SPELL IMMUNITY:No;DISPELLABLE:No;|MOVEMENT SLOW:-12%/-18%/-24%/-30%;RADIUS:400/425/450/475;DAMAGE:30/45/60/75;DURATION:10;|0|75|Kardel's modular rifle also fires incendiary rounds, useful for assaulting entrenched locations.|sniper
https://cdn.steamstatic.com/apps/dota2/videos/dota_react/abilities/sniper/sniper_take_aim|https://cdn.steamstatic.com/apps/dota2/images/dota_react/abilities/sniper_take_aim.png|TAKE AIM||Increases vision range, Headshot chance, and attack range. Slows you by 65% for the duration and restricts your vision to a frontal cone.|ABILITY:No Target;AFFECTS:Enemy Units;DISPELLABLE:Yes;|DURATION:3;HEADSHOT CHANCE:100%;BONUS ATTACK RANGE:100/150/200/250;BONUS VISION:500/750/1000/1250;|20/18/16/14|50|Kardel always takes it upon himself to stay as far from harm as he can while still performing his role - taking perfect aim.|sniper
https://cdn.steamstatic.com/apps/dota2/videos/dota_react/abilities/sniper/sniper_assassinate|https://cdn.steamstatic.com/apps/dota2/images/dota_react/abilities/sniper_assassinate.png|ASSASSINATE||Sniper locks onto a target enemy unit and, after a short aiming duration, fires a devastating shot that deals Sniper's attack damage plus bonus damage at long range and mini-stuns the target. Whenever Sniper kills an enemy hero, Assassinate is refreshed.|ABILITY:Unit Target;AFFECTS:Enemy Units;DAMAGE TYPE:Magical;PIERCES SPELL IMMUNITY:No;DISPELLABLE:No;|DAMAGE:300/400/500;STUN DURATION:0;AIM DURATION:0;AIM DURATION:2;|20/15/10|175|In order to fulfill the prophecy and return to his home town, Kardel must make another shot as perfect as the one on the day of his ancient test.|sniper
https://cdn.steamstatic.com/apps/dota2/videos/dota_react/abilities/sniper/sniper_aghanims_shard|https://cdn.steamstatic.com/apps/dota2/images/dota_react/abilities/sniper_concussive_grenade.png|CONCUSSIVE GRENADE|SHARD GRANTS NEW ABILITY|Launches a grenade at the target area, dealing damage to enemies and knocking them and Sniper himself back. Enemies affected are disarmed and have their movement slowed after the knockback.|ABILITY:Point Target;AFFECTS:Enemy Units;DAMAGE TYPE:Magical;PIERCES SPELL IMMUNITY:No;DISPELLABLE:Yes;|DAMAGE:200;RADIUS:375;MOVE SLOW:50%;SLOW DURATION:3;KNOCKBACK DISTANCE:475;|10|50|ATTN: IN CASE OF DANGER PULL PIN|sniper
https://cdn.steamstatic.com/apps/dota2/videos/dota_react/abilities/sniper/sniper_aghanims_scepter|https://cdn.steamstatic.com/apps/dota2/images/dota_react/abilities/sniper_assassinate.png|ASSASSINATE|SCEPTER ABILITY UPGRADE|Causes Assassinate to fire quicker and stun the enemy target.|||20/15/10|175|In order to fulfill the prophecy and return to his home town, Kardel must make another shot as perfect as the one on the day of his ancient test.|sniper
https://cdn.steamstatic.com/apps/dota2/videos/dota_react/abilities/spectre/spectre_spectral_dagger|https://cdn.steamstatic.com/apps/dota2/images/dota_react/abilities/spectre_spectral_dagger.png|SPECTRAL DAGGER||Spectre flings a dagger to draw a Shadow Path, dealing damage and slowing the movement speed of any enemies along the trail. Units hit by the dagger also trail a Shadow Path. While treading the path, Spectre moves faster and phases through otherwise impassable terrain.|ABILITY:Unit Target;AFFECTS:Enemy Heroes;DAMAGE TYPE:Magical;DISPELLABLE:Yes;|DAMAGE:70/120/170/220;MOVEMENT SPEED CHANGE:10%/14%/18%/22%;DURATION:7;|22/20/18/16|110/120/130/140|Mercurial's dagger eclipses the physical plane in shadow, a state in which mortals cower, but spectres thrive.|spectre
https://cdn.steamstatic.com/apps/dota2/videos/dota_react/abilities/spectre/spectre_haunt_single|https://cdn.steamstatic.com/apps/dota2/images/dota_react/abilities/spectre_haunt_single.png|SHADOW STEP||Creates a spectral nemesis to haunt a single visible enemy hero. At any moment during the duration, Spectre can use Reality to exchange places with any haunting illusion.<br><br>Haunt illusions are uncontrollable, take extra damage, and deal less damage than Spectre herself. They ignore terrain.|ABILITY:Unit Target;AFFECTS:Enemy Heroes;PIERCES SPELL IMMUNITY:Yes;|DURATION:6;HAUNT DAMAGE:40%/60%/80%;HAUNT DAMAGE TAKEN:200%;|60/55/50|150|With great focus of will, Mercurial can sometimes limit the extent of her division.|spectre
https://cdn.steamstatic.com/apps/dota2/videos/dota_react/abilities/spectre/spectre_aghanims_scepter|https://cdn.steamstatic.com/apps/dota2/images/dota_react/abilities/spectre_haunt.png|HAUNT|SCEPTER GRANTS NEW ABILITY|Creates a spectral nemesis to attack each enemy hero. Illusions spawned from this ability follow the same rules as Shadow Step illusions and can also be swapped to by using Reality.|ABILITY:No Target;PIERCES SPELL IMMUNITY:Yes;|HAUNT DURATION:6;HAUNT DAMAGE:80%;HAUNT DAMAGE TAKEN:200%;|160|150|At the height of combat, Mercurial's physical manifestation shatters, and the shadowy pieces haunt those who still cling to life.|spectre
https://cdn.steamstatic.com/apps/dota2/videos/dota_react/abilities/spirit_breaker/spirit_breaker_charge_of_darkness|https://cdn.steamstatic.com/apps/dota2/images/dota_react/abilities/spirit_breaker_charge_of_darkness.png|CHARGE OF DARKNESS||Spirit Breaker fixes his sight on an enemy unit and starts charging through all objects, starting at 25% of the bonus speed and reaching his max speed after 1.5s.<br><br>All enemy units passed through and the targeted unit will be hit by a Greater Bash. If the targeted unit dies, Spirit Breaker will change his target to the nearest enemy unit to that location.|ABILITY:Unit Target;AFFECTS:Enemy Units;PIERCES SPELL IMMUNITY:No;DISPELLABLE:No;|CHARGE BONUS SPEED:275/325/375/425;STUN DURATION:1.2/1.5/1.8/2.1;MIN LINGER TIME:0;MAX LINGER TIME:0;CHARGE FOR MAX LINGER:0;|22/19/16/13|90/100/110/120|Barathrum erupts from the darkness with unwieldy force.|spiritbreaker
https://cdn.steamstatic.com/apps/dota2/videos/dota_react/abilities/spirit_breaker/spirit_breaker_bulldoze|https://cdn.steamstatic.com/apps/dota2/images/dota_react/abilities/spirit_breaker_bulldoze.png|BULLDOZE||Spirit Breaker gains movement speed and status resistance to ram through enemies. Can be used while charging.|ABILITY:No Target;DISPELLABLE:Yes;|MOVEMENT SPEED:8%/12%/16%/20%;STATUS RESISTANCE:40%/50%/60%/70%;DURATION:8;|22/20/18/16|30/40/50/60|Barathrum warps the fabric of reality around him, lessening its influence on his physical form.|spiritbreaker
https://cdn.steamstatic.com/apps/dota2/videos/dota_react/abilities/spirit_breaker/spirit_breaker_greater_bash|https://cdn.steamstatic.com/apps/dota2/images/dota_react/abilities/spirit_breaker_greater_bash.png|GREATER BASH||Gives a chance to stun and knockback an enemy unit on an attack. Deals a percentage of movement speed as damage.|ABILITY:Passive;DAMAGE TYPE:Magical;PIERCES SPELL IMMUNITY:Yes;DISPELLABLE:Only Strong Dispels;|CHANCE TO BASH:17%;MOVEMENT SPEED AS DAMAGE:25%/30%/35%/40%;STUN DURATION:0.9/1.1/1.3/1.5;KNOCKBACK DURATION:0.5;|1.2|0|The signature strike of Barathrum's ghostly ball and chain.|spiritbreaker
https://cdn.steamstatic.com/apps/dota2/videos/dota_react/abilities/spirit_breaker/spirit_breaker_nether_strike|https://cdn.steamstatic.com/apps/dota2/images/dota_react/abilities/spirit_breaker_nether_strike.png|NETHER STRIKE||Spirit Breaker slips into the nether realm, reappearing next to his hapless victim. Upon reappearing, a Greater Bash of the current level occurs and deals bonus damage. Knocks back for double the normal distance.|ABILITY:Unit Target;AFFECTS:Enemy Units;DAMAGE TYPE:Magical;PIERCES SPELL IMMUNITY:Yes;DISPELLABLE:Only Strong Dispels;|BONUS DAMAGE:150/250/350;KNOCKBACK AMPLIFICATION:0%;KNOCKBACK AMPLIFICATION DURATION:0;|75/55/35|125/150/175|Barathrum temporarily returns to the realm from where he came, bringing with him the retribution of both worlds.|spiritbreaker
https://cdn.steamstatic.com/apps/dota2/videos/dota_react/abilities/spirit_breaker/spirit_breaker_aghanims_shard|https://cdn.steamstatic.com/apps/dota2/images/dota_react/abilities/spirit_breaker_charge_of_darkness.png|CHARGE OF DARKNESS|SHARD ABILITY UPGRADE|Increases Charge of Darkness Bonus Speed by 100.||||||spiritbreaker
https://cdn.steamstatic.com/apps/dota2/videos/dota_react/abilities/spirit_breaker/spirit_breaker_aghanims_scepter|https://cdn.steamstatic.com/apps/dota2/images/dota_react/abilities/spirit_breaker_planar_pocket.png|PLANAR POCKET|SCEPTER GRANTS NEW ABILITY|Barathrum gains magic resistance and distorts reality around the selected hero, making any unit-targeted spells cast by enemy heroes get redirected towards Spirit Breaker. Can be cast on both allied and enemy heroes, but only spells cast by enemies of Spirit Breaker will be redirected.|ABILITY:Unit Target;AFFECTS:Heroes;PIERCES SPELL IMMUNITY:No;DISPELLABLE:Only Strong Dispels;|DURATION:6;SELF MAGIC RESISTANCE:75%;|25|100|Barathrum's unyielding focus forms a pocket of planar convergence from which not even the most powerful arcane energies can escape.|spiritbreaker
https://cdn.steamstatic.com/apps/dota2/videos/dota_react/abilities/storm_spirit/storm_spirit_static_remnant|https://cdn.steamstatic.com/apps/dota2/images/dota_react/abilities/storm_spirit_static_remnant.png|STATIC REMNANT||Creates an explosively charged image of Storm Spirit that lasts 12 seconds and will detonate and deal damage if an enemy unit comes near it.|ABILITY:No Target;DAMAGE TYPE:Magical;PIERCES SPELL IMMUNITY:No;|RADIUS:300;DAMAGE:100/160/220/280;REMNANT SPEED:0;VISION RADIUS:100;|3.5|70/80/90/100|Raijin Thunderkeg's duality allows him to admire himself in shocking fashion.|stormspirit
https://cdn.steamstatic.com/apps/dota2/videos/dota_react/abilities/storm_spirit/storm_spirit_electric_vortex|https://cdn.steamstatic.com/apps/dota2/images/dota_react/abilities/storm_spirit_electric_vortex.png|ELECTRIC VORTEX||A vortex that pulls an enemy unit to Storm Spirit's location.|ABILITY:Unit Target;AFFECTS:Enemy Units;PIERCES SPELL IMMUNITY:No;DISPELLABLE:Only Strong Dispels;|PULL DISTANCE:180/220/260/300;RADIUS:0;DURATION:1.1/1.4/1.7/2;|20/18/16/14|60/70/80/90|Raijin's thunderous, boisterous energy often draws others into an electrifying situation.|stormspirit
https://cdn.steamstatic.com/apps/dota2/videos/dota_react/abilities/storm_spirit/storm_spirit_ball_lightning|https://cdn.steamstatic.com/apps/dota2/images/dota_react/abilities/storm_spirit_ball_lightning.png|BALL LIGHTNING||Storm Spirit becomes volatile electricity, charging across the battlefield until he depletes his mana or reaches his target. The activation mana cost is 25+7.5% of his total mana pool, and the cost per 100 units traveled is 10+0.65% of his total mana pool. Damage is expressed in damage per 100 units traveled.|ABILITY:Point Target;DAMAGE TYPE:Magical;PIERCES SPELL IMMUNITY:No;|DAMAGE:6/10/14;SPEED:1400/1850/2300;RADIUS:200;MANA DRAIN PER 100 UNITS:0.65%;|0|30|The Storm is coming in.|stormspirit
https://cdn.steamstatic.com/apps/dota2/videos/dota_react/abilities/storm_spirit/storm_spirit_aghanims_scepter|https://cdn.steamstatic.com/apps/dota2/images/dota_react/abilities/storm_spirit_electric_vortex.png|ELECTRIC VORTEX|SCEPTER ABILITY UPGRADE|Electric Vortex affects all enemies within a radius around Storm Spirit.|||20/18/16/14|60/70/80/90|Raijin's thunderous, boisterous energy often draws others into an electrifying situation.|stormspirit
