asset_video|asset_icon|name|shard_scepter|description|info|modifiers|cooldown|mana|lore|hero_id
https://cdn.steamstatic.com/apps/dota2/videos/dota_react/abilities/drow_ranger/drow_ranger_aghanims_shard|https://cdn.steamstatic.com/apps/dota2/images/dota_react/abilities/drow_ranger_glacier.png|GLACIER|SHARD GRANTS NEW ABILITY|Drow creates a hill of ice beneath her. While standing on the hill, attackers gain bonus attack range and high ground advantage - they cannot miss and gain flying vision. Drow additionally gets bonus Multishot arrows per wave while on the hill. The front of the hill obscures vision and cannot be moved through except by Drow. Does not interrupt Multishot when cast.|ABILITY:No Target;AFFECTS:Enemy Units;DAMAGE TYPE:Magical;PIERCES SPELL IMMUNITY:No;|DURATION:8;ATTACK RANGE BONUS:200;BONUS ARROWS PER WAVE:1;|20|50|Traxex wasn't just adopted by the Drow, she was adopted by the lands they lived in.|drowranger
https://cdn.steamstatic.com/apps/dota2/videos/dota_react/abilities/drow_ranger/drow_ranger_aghanims_scepter|https://cdn.steamstatic.com/apps/dota2/images/dota_react/abilities/drow_ranger_frost_arrows.png|FROST ARROWS|SCEPTER ABILITY UPGRADE|Frost Arrows now apply a Hypothermia stack to enemies, increasing damage from Frost Arrows and reducing their regeneration per stack. If an enemy dies with Hypothermia stacks, they burst and deal damage per stack and slow in an area around it.|||0/0/0/0|9/10/11/12|Ice-encased arrows pierce the silence, chilling their victims to the core.|drowranger
https://cdn.steamstatic.com/apps/dota2/videos/dota_react/abilities/earth_spirit/earth_spirit_boulder_smash|https://cdn.steamstatic.com/apps/dota2/images/dota_react/abilities/earth_spirit_boulder_smash.png|BOULDER SMASH||Earth Spirit smashes the target enemy or ally, sending them in the direction he is facing. If Earth Spirit targets an area, he will smash the nearest unit in a 200 radius, prioritizing Stone Remnants. The travelling unit or Remnant damages all enemy units it hits. If an enemy is hit by a Stone Remnant, they are also slowed. Stone Remnants travel further than other units.|ABILITY:Unit Target;AFFECTS:Heroes;DAMAGE TYPE:Magical;PIERCES SPELL IMMUNITY:No;DISPELLABLE:Yes;|REMNANT SMASH RADIUS:200;DAMAGE:110/180/250/320;SLOW AMOUNT:50%;SLOW DURATION:1.25/2.5/3.25/4;TRAVEL SPEED:900;DISTANCE:500/600/700/800;DISTANCE (REMNANT):2000;|22/18/14/10|100|It is with the power of a mountain that Earth Spirit strikes his enemies.|earthspirit
https://cdn.steamstatic.com/apps/dota2/videos/dota_react/abilities/earth_spirit/earth_spirit_rolling_boulder|https://cdn.steamstatic.com/apps/dota2/images/dota_react/abilities/earth_spirit_rolling_boulder.png|ROLLING BOULDER||Earth Spirit gathers himself into a boulder and, after a 0.6s delay, rolls toward the target location, dealing 60 + 100% STR damage and stunning enemy units. He will stop if he collides with an enemy hero or is stunned. If he rolls over a Stone Remnant, he will travel further and faster, and stun enemies for longer.|ABILITY:Point Target;DAMAGE TYPE:Magical;PIERCES SPELL IMMUNITY:No;DISPELLABLE:Only Strong Dispels;|SPEED:1000;SPEED (REMNANT):1600;SPEED (ALLIED HERO):0;DISTANCE:800;DISTANCE MULTIPLIER (REMNANT):2;DISTANCE MULTIPLIER (ALLIED HERO):0;DAMAGE:60/70/80/90;STUN DURATION:0.3/0.5/0.7/0.9;ROCK BONUS STUN DURATION:0.3/0.5/0.7/0.9;ALLIED HERO BONUS STUN DURATION:0/0/0/0;|16/12/8/4|50|Calling upon his connection to the land, the Earth Spirit draws loose stone to him, which forms a protective ball that he can use to roll short distances.|earthspirit
https://cdn.steamstatic.com/apps/dota2/videos/dota_react/abilities/earth_spirit/earth_spirit_geomagnetic_grip|https://cdn.steamstatic.com/apps/dota2/images/dota_react/abilities/earth_spirit_geomagnetic_grip.png|GEOMAGNETIC GRIP||Earth Spirit pulls the target Stone Remnant. Enemies struck by the gripped target will be silenced and take damage.|ABILITY:Unit Target;AFFECTS:Allied Units;DAMAGE TYPE:Magical;PIERCES SPELL IMMUNITY:No;DISPELLABLE:Yes;|REMNANT DAMAGE:70/140/210/280;SILENCE DURATION:2/2.5/3/3.5;HERO PULL SPEED:600;REMNANT PULL SPEED:900;|13|75|Like calls to like. Even the minerals found in the blood and bones of living beings are not immune to the call of the Earth Spirit.|earthspirit
https://cdn.steamstatic.com/apps/dota2/videos/dota_react/abilities/earth_spirit/earth_spirit_magnetize|https://cdn.steamstatic.com/apps/dota2/images/dota_react/abilities/earth_spirit_magnetize.png|MAGNETIZE||Magnetizes units in a small nearby area, causing them to take damage for a short duration. Magnetized heroes cause nearby Stone Remnants to explode, destroying the remnant and refreshing Magnetize's duration on all nearby enemies. This process can repeat multiple times. If an enemy hero is affected by Geomagnetic Grip or Boulder Smash, all magnetized heroes share the effects.|ABILITY:No Target;DAMAGE TYPE:Magical;PIERCES SPELL IMMUNITY:Yes;DISPELLABLE:Yes;|RADIUS:350;DAMAGE PER SECOND:45/85/125;MAGNETIZE DURATION:6;REMNANT REFRESH/EXPLOSION RADIUS:600;BONUS ATTACK DAMAGE:0/0/0;|100/90/80|100|At the Earth Spirit's call, the minerals in the blood and bones of his enemies rebel against the bodies they find themselves in.|earthspirit
https://cdn.steamstatic.com/apps/dota2/videos/dota_react/abilities/earth_spirit/earth_spirit_aghanims_shard|https://cdn.steamstatic.com/apps/dota2/images/dota_react/abilities/earth_spirit_geomagnetic_grip.png|GEOMAGNETIC GRIP|SHARD ABILITY UPGRADE|Can now grab allies.||||||earthspirit
https://cdn.steamstatic.com/apps/dota2/videos/dota_react/abilities/earth_spirit/earth_spirit_aghanims_scepter|https://cdn.steamstatic.com/apps/dota2/images/dota_react/abilities/earth_spirit_petrify.png|ENCHANT REMNANT|SCEPTER GRANTS NEW ABILITY|Earth Spirit temporarily enchants a hero, granting them the properties of a Stone Remnant. After a short duration the remnant shatters, releasing the hero and damaging nearby enemies. < br><br>Can be cast on Stone Remnants. Has a 5 second cooldown when used that way.<br>Has a larger cast range when cast on an ally hero.|ABILITY:Unit Target;DAMAGE TYPE:Magical;PIERCES SPELL IMMUNITY:No;DISPELLABLE:No;|REMNANT DURATION:2.4;SHATTER DAMAGE:450;SHATTER RADIUS:450;CAST RANGE ON ALLIES:500;|45|150|Kaolin uses the elemental power of the Earth to temporarily petrify living beings, so that they might be conscripted into his stone funerary army.|earthspirit
https://cdn.steamstatic.com/apps/dota2/videos/dota_react/abilities/earthshaker/earthshaker_fissure|https://cdn.steamstatic.com/apps/dota2/images/dota_react/abilities/earthshaker_fissure.png|FISSURE||Slams the ground with a mighty totem, creating an impassable ridge of stone while stunning and damaging enemy units along its line.|ABILITY:Point Target;AFFECTS:Enemy Units;DAMAGE TYPE:Magical;PIERCES SPELL IMMUNITY:No;DISPELLABLE:Only Strong Dispels;|FISSURE DURATION:6.5/7/7.5/8;STUN DURATION:0.8/1/1.2/1.4;DAMAGE:110/170/230/290;AFTERSHOCK STUN PCT:0%;FREE PATHING LINGER TIME:0;COOLDOWN:18/17/16/15;|18/17/16/15|120/125/130/135|The Nishian totem splits the world to its core with tectonic force.|earthshaker
https://cdn.steamstatic.com/apps/dota2/videos/dota_react/abilities/earthshaker/earthshaker_enchant_totem|https://cdn.steamstatic.com/apps/dota2/images/dota_react/abilities/earthshaker_enchant_totem.png|ENCHANT TOTEM||Empowers Earthshaker's totem, causing it to deal extra damage and have 100 bonus attack range on the next attack.|ABILITY:No Target;AFFECTS:Enemy Units;DISPELLABLE:Yes;|BONUS:100%/200%/300%/400%;JUMP DISTANCE:0;CLEAVE DAMAGE:0%;CLEAVE DISTANCE:0;DURATION:14;|5|45/55/65/75|Raigor's gorilla strength can destroy mountains.|earthshaker
https://cdn.steamstatic.com/apps/dota2/videos/dota_react/abilities/earthshaker/earthshaker_echo_slam|https://cdn.steamstatic.com/apps/dota2/images/dota_react/abilities/earthshaker_echo_slam.png|ECHO SLAM||Shockwaves travel through the ground, damaging enemy units. Each enemy hit causes an echo to damage nearby units. Real heroes cause two echoes.|ABILITY:No Target;DAMAGE TYPE:Magical;PIERCES SPELL IMMUNITY:No;|RADIUS:700;ECHO DAMAGE:90/100/110;INITIAL DAMAGE:100/140/180;|130/120/110|150/200/250|Tectonic plates crack, mountains fold, and foes are crushed by the Echo Slam.|earthshaker
https://cdn.steamstatic.com/apps/dota2/videos/dota_react/abilities/earthshaker/earthshaker_aghanims_shard|https://cdn.steamstatic.com/apps/dota2/images/dota_react/abilities/earthshaker_fissure.png|FISSURE|SHARD ABILITY UPGRADE|Reduces Fissure cooldown and allows Earthshaker to walk on it. When he casts any ability, an Aftershock is released along its path that stuns for a shortened duration.||||||earthshaker
https://cdn.steamstatic.com/apps/dota2/videos/dota_react/abilities/earthshaker/earthshaker_aghanims_scepter|https://cdn.steamstatic.com/apps/dota2/images/dota_react/abilities/earthshaker_enchant_totem.png|ENCHANT TOTEM|SCEPTER ABILITY UPGRADE|Enchant Totem becomes a ground target ability, causing Earthshaker to jump in the air and land at the target spot, casting Enchant Totem there. Self-casting the ability will behave in the original form, without jumping. Grants Enchant Totem a cleaving attack.|||5|45/55/65/75|Raigor's gorilla strength can destroy mountains.|earthshaker
https://cdn.steamstatic.com/apps/dota2/videos/dota_react/abilities/elder_titan/elder_titan_echo_stomp|https://cdn.steamstatic.com/apps/dota2/images/dota_react/abilities/elder_titan_echo_stomp.png|ECHO STOMP||CHANNELED - Elder Titan and his Astral Spirit both stomp the ground, damaging and knocking nearby enemy units unconscious around their locations. The Elder Titan stomp deals physical damage, while the Spirit stomp deals magical damage.|ABILITY:No Target;DAMAGE TYPE:Physical;PIERCES SPELL IMMUNITY:No;DISPELLABLE:Only Strong Dispels;|CAST TIME:1.7;RADIUS:475;SLEEP DURATION:2/2.8/3.6/4.4;STOMP DAMAGE:60/100/140/180;WAKEUP DAMAGE THRESHOLD:100/150/200/250;COOLDOWN:14/13/12/11;|14/13/12/11|100|The force of creation still echoes in the stomp of the Titan.|eldertitan
https://cdn.steamstatic.com/apps/dota2/videos/dota_react/abilities/elder_titan/elder_titan_ancestral_spirit|https://cdn.steamstatic.com/apps/dota2/images/dota_react/abilities/elder_titan_ancestral_spirit.png|ASTRAL SPIRIT||Elder Titan sends forth his Astral Spirit, damaging any units it passes through. When the spirit rejoins the Titan, it grants bonus damage, armor, and movement speed for each unit it passed through.<br><br>The Astral Spirit possesses the Echo Stomp, Return Spirit, and Natural Order abilities.|ABILITY:Point Target;DAMAGE TYPE:Magical;PIERCES SPELL IMMUNITY:Yes;DISPELLABLE:Yes;|RADIUS:275;DAMAGE:50;DURATION:10;BUFF DURATION:10;BONUS SPEED (CREEPS):1.5%;BONUS SPEED (HEROES):4%/5%/6%/7%;BONUS DAMAGE (CREEPS):3/7/11/15;BONUS DAMAGE (HEROES):17/38/59/80;BONUS ARMOR (CREEPS):0.5;BONUS ARMOR (HEROES):1.5/3/4.5/6;|23/21/19/17|80/90/100/110|Like the four fundamentals, Elder Titan exists across all planes at once and can draw other aspects of himself to assist in times of need.|eldertitan
https://cdn.steamstatic.com/apps/dota2/videos/dota_react/abilities/elder_titan/elder_titan_earth_splitter|https://cdn.steamstatic.com/apps/dota2/images/dota_react/abilities/elder_titan_earth_splitter.png|EARTH SPLITTER||Sends forth a jagged crack in front of Elder Titan. After 3 seconds, the crack implodes, slowing movement while dealing damage to each enemy based on their maximum life. Half of the damage dealt is Magical damage, while the other half is Physical damage.|ABILITY:Point Target;AFFECTS:Enemy Units;DAMAGE TYPE:Magical;PIERCES SPELL IMMUNITY:Yes;DISPELLABLE:Yes;|IMPLODE DELAY:2.72;CRACK WIDTH:315;CRACK LENGTH:2400;MOVEMENT SLOW:30%/40%/50%;SLOW DURATION:3/4/5;MAX HP AS DAMAGE:34%/42%/50%;|100|125/175/225|That which he created, the titan tears asunder.|eldertitan
https://cdn.steamstatic.com/apps/dota2/videos/dota_react/abilities/elder_titan/elder_titan_aghanims_shard|https://cdn.steamstatic.com/apps/dota2/images/dota_react/abilities/elder_titan_echo_stomp.png|ECHO STOMP|SHARD ABILITY UPGRADE|Lowers Cooldown. Echo Stomp may be placed on alt-cast to allow Elder Titan to take the place of the Astral Spirit as it completes its stomp.||||||eldertitan
https://cdn.steamstatic.com/apps/dota2/videos/dota_react/abilities/elder_titan/elder_titan_aghanims_scepter|https://cdn.steamstatic.com/apps/dota2/images/dota_react/abilities/elder_titan_ancestral_spirit.png|ASTRAL SPIRIT|SCEPTER ABILITY UPGRADE|Causes Elder Titan to become debuff immune and gain 50% magic resistance for 2 seconds per affected enemy Hero when the spirit returns.|||23/21/19/17|80/90/100/110|Like the four fundamentals, Elder Titan exists across all planes at once and can draw other aspects of himself to assist in times of need.|eldertitan
https://cdn.steamstatic.com/apps/dota2/videos/dota_react/abilities/ember_spirit/ember_spirit_searing_chains|https://cdn.steamstatic.com/apps/dota2/images/dota_react/abilities/ember_spirit_searing_chains.png|SEARING CHAINS||Ember Spirit unleashes fiery bolas that wrap around nearby enemies, anchoring them in place and dealing damage each second.|ABILITY:No Target;DAMAGE TYPE:Magical;PIERCES SPELL IMMUNITY:No;DISPELLABLE:Yes;|DURATION:1.5/2/2.5/3;RADIUS:400;DAMAGE PER SECOND:50/70/90/110;UNIT COUNT:2;|13/12/11/10|95/105/115/125|Xin's harshest lessons often employed the use of red-hot chains.|emberspirit
https://cdn.steamstatic.com/apps/dota2/videos/dota_react/abilities/ember_spirit/ember_spirit_sleight_of_fist|https://cdn.steamstatic.com/apps/dota2/images/dota_react/abilities/ember_spirit_sleight_of_fist.png|SLEIGHT OF FIST||Ember Spirit dashes around with blazing speed, attacking all enemies in the targeted area of effect, then returning to his start location. Deals bonus damage to heroes.|ABILITY:Point Target;DAMAGE TYPE:Physical;PIERCES SPELL IMMUNITY:Yes;|RADIUS:250/350/450/550;BONUS HERO DAMAGE:25/70/115/160;ATTACK INTERVAL:0.25;|13/11/9/7|60/65/70/75|The studied warrior must whip and weave through its enemies, burning each without pause.|emberspirit
https://cdn.steamstatic.com/apps/dota2/videos/dota_react/abilities/ember_spirit/ember_spirit_flame_guard|https://cdn.steamstatic.com/apps/dota2/images/dota_react/abilities/ember_spirit_flame_guard.png|FLAME GUARD||Ember Spirit surrounds himself with a ring of fire that consumes incoming magic damage, absorbing a percentage of the damage taken. Flame Guard deals damage per second in an area around Ember Spirit while Flame Guard is active. If the shield is broken, the damage is also lost.|ABILITY:No Target;DAMAGE TYPE:Magical;PIERCES SPELL IMMUNITY:No;DISPELLABLE:Yes;|DURATION:12/14/16/18;DAMAGE PER SECOND:20/30/40/50;RADIUS:500;PERCENTAGE ABSORBED:70%;MAGIC BARRIER:60/140/220/300;|35|65/80/95/110|An enemy should never be allowed to approach without difficulty.|emberspirit
https://cdn.steamstatic.com/apps/dota2/videos/dota_react/abilities/ember_spirit/ember_spirit_activate_fire_remnant|https://cdn.steamstatic.com/apps/dota2/images/dota_react/abilities/ember_spirit_activate_fire_remnant.png|ACTIVATE FIRE REMNANT||Select the Fire Remnant to arrive at.|ABILITY:Point Target;DAMAGE TYPE:Magical;PIERCES SPELL IMMUNITY:No;||0|100/125/150|With blazing speed does a spirit fly!|emberspirit
https://cdn.steamstatic.com/apps/dota2/videos/dota_react/abilities/ember_spirit/ember_spirit_fire_remnant|https://cdn.steamstatic.com/apps/dota2/images/dota_react/abilities/ember_spirit_fire_remnant.png|FIRE REMNANT||Sends a Fire Remnant that runs to the target location at 250% Ember Spirit's speed. Using Activate Fire Remnant, Ember Spirit will dash out to all active Fire Remnants, destroying them and dealing damage in an area and then moving to the nearest Remnant. Ember Spirit will end at the Remnant closest to the targeted location.|ABILITY:Point Target;DAMAGE TYPE:Magical;PIERCES SPELL IMMUNITY:No;|DAMAGE:100/200/300;RADIUS:450;DURATION:45;RANGE:0;SPEED MULTIPLIER:0;MAX CHARGES:0;CHARGE RADIUS:0;|0.5|0|By the spirit's power are Xin's teachings spread anew.|emberspirit
https://cdn.steamstatic.com/apps/dota2/videos/dota_react/abilities/ember_spirit/ember_spirit_aghanims_scepter|https://cdn.steamstatic.com/apps/dota2/images/dota_react/abilities/ember_spirit_fire_remnant.png|FIRE REMNANT|SCEPTER ABILITY UPGRADE|Increases cast range, initial remnant speed, and maximum charges.|||0.5|0|By the spirit's power are Xin's teachings spread anew.|emberspirit
https://cdn.steamstatic.com/apps/dota2/videos/dota_react/abilities/enchantress/enchantress_impetus|https://cdn.steamstatic.com/apps/dota2/images/dota_react/abilities/enchantress_impetus.png|IMPETUS||Places an enchantment on each attack while activated, causing it to deal additional damage based on how far away the target is. The farther the target, the greater the damage dealt. Deals double damage to illusions.|ABILITY:Unit Target;AFFECTS:Enemy Units;DAMAGE TYPE:Pure;PIERCES SPELL IMMUNITY:No;|DISTANCE DAMAGE:5%/10%/15%/20%;|6/4/2/0|40/45/50/55|While Aiushtha favors peaceful means, she is capable of a magical onslaught from a distance, her spears gaining energy from the natural life around her.|enchantress
https://cdn.steamstatic.com/apps/dota2/videos/dota_react/abilities/enchantress/enchantress_enchant|https://cdn.steamstatic.com/apps/dota2/images/dota_react/abilities/enchantress_enchant.png|ENCHANT||Enchantress charms an enemy. If the enemy is a hero, they are dispelled and slowed for 3.5s.<br><br>If the enemy is a creep, she brings it under her control and receives 40% of their experience bounty. Enchantress can control creeps for up to 30s. <br><br>DISPEL TYPE: Basic Dispel|ABILITY:Unit Target;AFFECTS:Enemy Units;PIERCES SPELL IMMUNITY:No;DISPELLABLE:Yes;|HERO MOVE SLOW:-30%/-40%/-50%/-60%;ATTACK RANGE BONUS:0/0/0/0;CREEP MAX HEALTH BONUS:150/250/350/450;CREEP ATTACK DAMAGE BONUS:0/25/50/75;CREEP MAX LEVEL:4/5/6/6;MAX ENCHANTED CREEPS:1;CAST RANGE:500/550/600/650;|30/24/18/12|70|A true steward of the forest, Aiushtha befriends all within it - from lowly trolls to powerful centaurs.|enchantress
https://cdn.steamstatic.com/apps/dota2/videos/dota_react/abilities/enchantress/enchantress_natures_attendants|https://cdn.steamstatic.com/apps/dota2/images/dota_react/abilities/enchantress_natures_attendants.png|NATURE'S ATTENDANTS||A cloud of wisps heals Enchantress and any friendly units nearby.|ABILITY:No Target;PIERCES SPELL IMMUNITY:Yes;DISPELLABLE:No;|DURATION:7/9/11/13;HEAL PER SECOND:4/8/12/16;RADIUS:275;WISPS:9;|35|140|Whimsical spirits of the woods possess a healing power that is quite subtle, but gains strength in numbers.|enchantress
https://cdn.steamstatic.com/apps/dota2/videos/dota_react/abilities/enchantress/enchantress_aghanims_shard|https://cdn.steamstatic.com/apps/dota2/images/dota_react/abilities/enchantress_bunny_hop.png|SPROINK|SHARD GRANTS NEW ABILITY|Leaps backward, dodges incoming projectiles, and launches an Impetus attack on the 2 furthest enemy units within Enchantress' attack range + 100.|ABILITY:No Target;PIERCES SPELL IMMUNITY:No;|LEAP DISTANCE:500;TARGETS:2;BONUS RANGE:100;|10|60|Sproink is as Sproink does.|enchantress
https://cdn.steamstatic.com/apps/dota2/videos/dota_react/abilities/enchantress/enchantress_aghanims_scepter|https://cdn.steamstatic.com/apps/dota2/images/dota_react/abilities/enchantress_little_friends.png|LITTLE FRIENDS|SCEPTER GRANTS NEW ABILITY|Enchantress roots an enemy unit. All creeps, ally, enemy and neutral within a radius will gain bonus movement and attack speed and attack the chosen target for 6 seconds.|ABILITY:Unit Target;AFFECTS:Enemy Units;PIERCES SPELL IMMUNITY:No;DISPELLABLE:No;|BONUS ATTACK SPEED:100;BONUS MOVE SPEED:100%;RADIUS:1200;MINIMUM ROOT DURATION:2;ROOT DURATION PER UNIT:0.5;|20|75|The laws of the forest may be oblique, but punishment for breaking them is swift and smiling.|enchantress
https://cdn.steamstatic.com/apps/dota2/videos/dota_react/abilities/enigma/enigma_malefice|https://cdn.steamstatic.com/apps/dota2/images/dota_react/abilities/enigma_malefice.png|MALEFICE||Focuses Enigma's power on a target, causing it to take damage and become repeatedly stunned for multiple instances. An instance strikes every 2 seconds.|ABILITY:Unit Target;AFFECTS:Enemy Units;DAMAGE TYPE:Magical;PIERCES SPELL IMMUNITY:No;DISPELLABLE:Yes;|STUN DURATION:0.3/0.5/0.7/0.9;DAMAGE PER INSTANCE:55/70/85/100;INSTANCES:3;|20/18/16/14|100/110/120/130|Strange gravities pull at the core of those who would oppose you, holding them in place.|enigma
https://cdn.steamstatic.com/apps/dota2/videos/dota_react/abilities/enigma/enigma_demonic_conversion|https://cdn.steamstatic.com/apps/dota2/images/dota_react/abilities/enigma_demonic_conversion.png|DEMONIC SUMMONING||Summons three fragments of Enigma himself at the cost of health. The eidolons health is increased by 3% of Enigma's current health. These eidolons are all under Enigma's control, and repeated successful attacks cause them to multiply. When this happens, the eidolons have their health restored.|ABILITY:Point Target;DAMAGE TYPE:Physical;|SPAWN COUNT:3;ATTACKS TO MULTIPLY:6;EIDOLON HP:180/200/220/240;EIDOLON DAMAGE:16/27/38/49;EIDOLON MAGIC RESISTANCE:30%/40%/50%/60%;EIDOLON ATTACK RANGE:425/450/475/500;DURATION:40;|40/38/36/34|70/80/90/100|Enigma is capable of drawing aspects of himself from other dimensions - the result is a trio of dark eidolons that hunt the corporeal plane.|enigma
https://cdn.steamstatic.com/apps/dota2/videos/dota_react/abilities/enigma/enigma_midnight_pulse|https://cdn.steamstatic.com/apps/dota2/images/dota_react/abilities/enigma_midnight_pulse.png|MIDNIGHT PULSE||Steeps an area in dark resonance, dealing 5 + a percentage of the enemies current HP as damage.|ABILITY:Point Target;DAMAGE TYPE:Magical;PIERCES SPELL IMMUNITY:Yes;|RADIUS:600;CURRENT HEALTH AS DAMAGE:4%/6%/8%/10%;DURATION:9/10/11/12;|40/35/30/25|65/90/115/140|A section of the world slowly descends into the void.|enigma
https://cdn.steamstatic.com/apps/dota2/videos/dota_react/abilities/enigma/enigma_black_hole|https://cdn.steamstatic.com/apps/dota2/images/dota_react/abilities/enigma_black_hole.png|BLACK HOLE||CHANNELED - Summons a vortex that sucks in nearby enemy units. Enemies affected by Black Hole cannot move, attack, or cast spells.|ABILITY:Point Target;DAMAGE TYPE:Pure;PIERCES SPELL IMMUNITY:Yes;|DAMAGE PER SECOND:100/150/200;RADIUS:420;DURATION:4;|180/170/160|300/400/500|The ground trembles as Enigma channels his ultimate vortex of destruction, a singularity with the power to end worlds.|enigma
https://cdn.steamstatic.com/apps/dota2/videos/dota_react/abilities/enigma/enigma_aghanims_shard|https://cdn.steamstatic.com/apps/dota2/images/dota_react/abilities/enigma_malefice.png|MALEFICE|SHARD ABILITY UPGRADE|Increases Malefice stun duration by 0.3s and creates an Eidolon next to the target every instance of Malefice stun. These Eidolons will not multiply further.||||||enigma
https://cdn.steamstatic.com/apps/dota2/videos/dota_react/abilities/enigma/enigma_aghanims_scepter|https://cdn.steamstatic.com/apps/dota2/images/dota_react/abilities/enigma_black_hole.png|BLACK HOLE|SCEPTER ABILITY UPGRADE|Black Hole deals additional damage equivalent to 4% of the unit's Max Health per second and does a non-interrupting pull towards it in a 1200 AoE. Pulls at a rate of 175.|||180/170/160|300/400/500|The ground trembles as Enigma channels his ultimate vortex of destruction, a singularity with the power to end worlds.|enigma
https://cdn.steamstatic.com/apps/dota2/videos/dota_react/abilities/faceless_void/faceless_void_time_walk|https://cdn.steamstatic.com/apps/dota2/images/dota_react/abilities/faceless_void_time_walk.png|TIME WALK||Rushes to a target location while backtracking any damage taken the last 2 seconds.|ABILITY:Point Target;PIERCES SPELL IMMUNITY:Yes;|RANGE:650/700/750/800;BACKTRACK DURATION:2;TIME LOCK RADIUS:0;|21/16/11/6|40|Darkterror tears a hole in time, passing through Claszureme, and appearing back in an instant.|facelessvoid
https://cdn.steamstatic.com/apps/dota2/videos/dota_react/abilities/faceless_void/faceless_void_time_dilation|https://cdn.steamstatic.com/apps/dota2/images/dota_react/abilities/faceless_void_time_dilation.png|TIME DILATION||Faceless Void traps all nearby enemies in a time dilation field for 8 seconds, extending their cooldowns and slowing their movement and attack speed by 7% for each cooldown extended. Deals bonus damage per second for each cooldown.|ABILITY:No Target;DAMAGE TYPE:Magical;PIERCES SPELL IMMUNITY:No;DISPELLABLE:Yes;|RADIUS:775;DURATION:8/9/10/11;SLOW PER COOLDOWN:7%/8%/9%/10%;COOLDOWN PROGRESSION SLOW:30%/40%/50%/60%;BONUS DPS PER COOLDOWN:7/9/11/13;|28/24/20/16|90|For those facing off against Darkterror, each moment seems to stretch into eternity.|facelessvoid
https://cdn.steamstatic.com/apps/dota2/videos/dota_react/abilities/faceless_void/faceless_void_chronosphere|https://cdn.steamstatic.com/apps/dota2/images/dota_react/abilities/faceless_void_chronosphere.png|CHRONOSPHERE||Creates a blister in spacetime, trapping all units caught in its sphere of influence and causes you to move very quickly inside it. Only Faceless Void and any units he controls are unaffected. Invisible enemies in the sphere will be revealed.|ABILITY:Point Target;PIERCES SPELL IMMUNITY:Yes;DISPELLABLE:No;|RADIUS:500;DURATION:3.75/4.25/4.75;|155/145/135|125/200/275|When a rift opens to Claszureme, all poor souls caught within will likely never return.|facelessvoid
